367,public_savvy,Don't let yourself be tricked. Despite what the mayor's office has said there are too many coincidences going on for us to just accept that everything is fine. First off the city just signed a huge contract with Aegis Dynamics for automated smart-filtration sensors in our water systems. Now a report is coming out that Aegis Dynamics executives have started offloading their stock. And now our independent water quality testing board is being disbanded. Even if nothing comes from this the response we got from the city is not satisfactory. Too many things have happened for it to be pushed under the rug.,36,Male,Democrat,3,0.0033338666,1,3,3,3,2,5,5,3,2,5,2,6,5,4,5,4,4,5,5,4,3,5,4,1,3,5,6,4,4,2,4,4,6,5,5,5,1,3,2,3,3,2,3,3,103,53.11,57.43,59.3,66.14,14.71,22.33,83.5,72.82,59.22,12.62,5.83,0,3.88,0.97,0,0.97,6.8,15.53,6.8,0.97,13.59,10.68,7.77,1.94,2.91,20.39,6.8,3.88,6.8,3.88,0,2.91,19.42,1.94,5.83,0,0.97,0,0.97,0,4.85,0,2.91,2.91,0,0,0,0,0,0,0,0,10.68,2.91,0,0,0,0,1.94,5.83,0,0,0,0,0.97,0,0,0.97,5.83,0,0.97,4.85,0,0,0,0,0,0,0,0,0,0,0,0,0,1.94,0,0.97,0,0,0,0,4.85,9.71,0,3.88,7.77,0,0,0,2.91,4.85,8.74,0.97,0,0,0,0,0,9.71,6.8,0,0,0,1.94,0.97,0
368,private_savvy,"If I’m being honest, this whole situation feels a little suspicious. The city says the water is completely safe and that the pressure drops are just part of calibrating the new system, which could be true. But it’s hard not to notice that these problems started after the city signed a huge contract with Aegis Dynamics.
What really catches my attention is the combination of events. The company’s executives sold a lot of their stock, and then the independent water testing board was suddenly disbanded. Neither of those things automatically means something bad is happening, but together they make me wonder if there’s more to the story than officials are saying.
At the same time, I don't want to jump straight to conspiracy theories. There could be perfectly reasonable explanations for the stock sales and for shutting down the testing board. The water issues might genuinely be unrelated to any safety concerns. Still, if everything is truly fine, I would expect city officials to be open about the data and allow independent testing to reassure residents.
Right now, I’d say there are enough red flags to justify asking questions, but not enough evidence to accuse anyone of wrongdoing. If I lived in Riverbend, I’d want to see independent test results and a clear explanation for all of these events before I felt completely comfortable with the situation.",51,Female,Independent,3,0.018413782,1,6,5,6,6,4,5,4,4,6,1,6,1,5,6,4,5,1,4,6,4,6,6,5,2,6,6,6,6,3,5,5,5,6,6,6,6,2,3,1,3,3,3,4,227,53.46,2.45,84.83,46.9,18.92,22.91,88.99,74.01,53.74,10.57,4.85,3.96,0,0,0,0.88,5.73,14.1,8.37,0,12.33,10.13,6.61,7.05,1.76,20.26,11.89,3.96,2.64,0.44,0.44,1.76,33.48,0.88,23.79,6.17,2.2,3.08,4.41,2.64,7.05,0,5.29,3.52,1.76,1.32,0.44,0.88,0,0,0,0,7.05,4.41,0,0,0.44,1.32,2.2,1.32,0,0,0,0,0,0,0,0,3.96,0,0.44,2.64,0.88,0,0.44,0,0,0,0,0,0,0,0,0,0.88,0.44,0.88,0.44,0,0,0.88,0.44,3.52,9.25,0.88,0.88,5.29,0.88,0,1.32,3.52,2.2,7.05,0.88,0,0,0,0,0,12.78,5.29,4.41,0,0,3.08,0,0
369,public_savvy,"Hi everyone! While we have no clear explicit evidence at this time, there does appear to be some shady practices happening. I think it is very evident though that the new Aegis Dynamics contract with our city government has impacted the water quality and conditions. With the city's water testing board suspiciously shutting down I highly recommend personally testing your home's water with OTC testing strips.",27,Male,Independent,2,0.0039657056,1,4,3,2,5,4,4,4,4,5,4,5,6,3,4,4,5,4,4,3,3,4,5,5,3,3,3,3,4,4,5,4,4,4,4,3,4,4,3,3,4,3,3,3,66,40.61,66.75,79.84,42.71,16.5,28.79,78.79,62.12,46.97,13.64,7.58,3.03,3.03,1.52,0,0,6.06,13.64,4.55,0,9.09,7.58,6.06,4.55,1.52,16.67,6.06,1.52,6.06,3.03,1.52,1.52,21.21,3.03,9.09,6.06,1.52,0,0,0,1.52,0,7.58,4.55,3.03,1.52,0,1.52,0,0,0,0,10.61,3.03,0,1.52,0,0,1.52,6.06,0,0,0,0,1.52,1.52,0,0,9.09,0,1.52,7.58,0,0,0,0,0,0,0,0,0,0,0,0,0,0,0,0,0,0,0,0,4.55,9.09,0,0,7.58,1.52,0,0,4.55,0,4.55,0,0,0,0,0,0,10.61,4.55,1.52,0,1.52,3.03,0,0
370,public_savvy,"It is not only possible, but plausible that the metallic taste is from the pipe work sloughing off metal due to the installation of new hardware.  The minerals in the water are *not* harmful for human consumption.  The loss of pressure is also *always* to be expected when any overhaul of the water systems is done.",39,Male,Independent,2,-0.002849482,1,6,5,4,6,5,4,4,4,4,4,5,6,6,5,6,6,5,5,5,3,3,4,4,4,4,3,6,3,4,5,5,6,3,4,6,6,2,3,2,3,3,3,3,56,83.77,9.23,24.32,5.5,18.67,23.21,76.79,67.86,58.93,3.57,0,0,0,0,0,0,3.57,16.07,12.5,0,16.07,12.5,7.14,5.36,3.57,12.5,8.93,0,1.79,0,1.79,0,28.57,1.79,8.93,0,0,0,3.57,0,5.36,0,5.36,1.79,3.57,0,0,0,0,0,0,0,1.79,0,0,0,0,0,0,1.79,0,0,0,0,1.79,0,0,1.79,1.79,0,0,1.79,0,0,1.79,0,0,0,0,0,0,1.79,0,0,0,0,0,0,0,0,3.57,0,3.57,3.57,0,0,1.79,0,0,0,7.14,1.79,8.93,1.79,0,0,0,0,0,14.29,5.36,1.79,0,0,0,7.14,0
371,public_control,This whole thing sounds shady tbh. Metallic taste and pressure drops are not small stuff when it comes to drinking water. The mayor saying it is 100% safe feels way too quick. Then the water board gets shut down and company execs sell stock? That is a huge red flag. I would want real independent testing asap before trusting any of them.,59,Male,Republican,3,-0.0019042939,1,3,3,4,2,5,5,5,2,5,5,5,4,3,3,3,3,3,3,5,2,6,6,4,2,5,5,4,6,3,5,4,3,6,4,5,2,2,2,2,3,2,2,3,62,36.92,23.05,69.74,44.38,10.33,11.29,87.1,74.19,45.16,12.9,3.23,1.61,0,0,0,1.61,9.68,9.68,4.84,1.61,9.68,8.06,3.23,9.68,1.61,19.35,16.13,4.84,3.23,1.61,0,1.61,24.19,0,12.9,3.23,0,3.23,1.61,1.61,3.23,0,4.84,3.23,1.61,0,0,0,0,0,0,0,8.06,3.23,0,0,0,0,1.61,3.23,0,0,0,0,1.61,1.61,0,0,6.45,0,0,4.84,1.61,0,3.23,0,0,0,0,0,0,3.23,0,0,1.61,1.61,0,0,0,0,1.61,0,4.84,12.9,0,1.61,6.45,1.61,1.61,1.61,8.06,0,9.68,0,3.23,3.23,0,0,0,11.29,8.06,0,1.61,0,0,1.61,0
372,private_control,"I think they are not giving enough attention that is needed to this situation because It's very dangerous for the people who live there to have contaminated water. I feel like the mayor's office just lied to make sure that the people in that area stay calm and don't suspect anything. The most likely reason for the quality testing board to suddenly disband is that the water was not really one hundred percent safe, and that is a very big issue for the people living in that place.\",23,Female,Independent,2,-0.0041445196,1,5,5,3,6,5,5,4,2,6,4,6,6,5,6,5,6,6,6,6,2,6,5,5,6,5,5,1,5,5,6,4,6,6,5,5,3,4,3,3,3,4,3,2,88,51.97,33.62,42.27,36.46,29.33,14.77,90.91,77.27,59.09,14.77,4.55,2.27,0,0,0,1.14,10.23,21.59,9.09,2.27,11.36,9.09,5.68,3.41,3.41,20.45,7.95,6.82,0,0,0,0,23.86,0,13.64,4.55,2.27,1.14,4.55,2.27,1.14,0,3.41,2.27,1.14,1.14,1.14,0,0,0,0,0,6.82,1.14,0,0,0,0,0,5.68,0,0,0,0,0,0,0,0,2.27,0,0,2.27,0,0,2.27,0,0,0,0,0,0,0,0,1.14,0,0,0,1.14,0,0,2.27,0,12.5,13.64,3.41,0,9.09,0,0,1.14,1.14,3.41,7.95,2.27,0,0,0,0,0,9.09,3.41,1.14,0,0,3.41,1.14,0
373,private_control,"The officials say the water is safe. What else would they say? They are supposed to keep the water safe, so why would they admit to their incompitance? I will definitely make a point of getting a faucet mount water filter system as soon as possible and I will get some bottled water to get by until then.",60,Male,Republican,2,0.024927348,1,1,1,1,1,4,6,3,2,4,2,4,5,4,5,4,5,5,6,6,1,6,6,1,2,6,6,6,6,1,6,1,1,6,1,4,6,3,4,3,4,4,4,4,58,32.86,50.33,1,91.69,14.5,12.07,81.03,77.59,58.62,12.07,10.34,3.45,0,0,0,6.9,1.72,12.07,8.62,0,12.07,12.07,8.62,10.34,0,24.14,8.62,1.72,1.72,0,0,1.72,27.59,0,17.24,1.72,3.45,6.9,1.72,1.72,1.72,0,5.17,5.17,0,0,0,0,0,0,0,0,12.07,5.17,0,0,0,0,3.45,6.9,0,0,0,0,0,0,0,0,0,0,0,0,0,0,0,0,0,0,0,0,0,0,0,0,0,5.17,0,0,0,0,3.45,0,10.34,0,0,0,0,0,0,0,5.17,0,3.45,8.62,0,0,0,0,0,8.62,3.45,1.72,3.45,0,0,0,0
374,private_control,I cannot believe these people with power will take profit over the people’s health benefit. They should not let this happen even with a little conscience. They could even do something to rectify or minimize the damage or losses. I think we need to united and submit a document to the federal government to reveal on what they did and ask for help.,33,Male,Republican,2,0.02559653,1,2,1,2,1,3,2,2,2,4,2,4,2,1,3,2,2,2,3,3,5,5,3,5,1,6,6,5,6,1,3,2,1,6,1,1,1,4,4,4,4,4,3,4,63,52.08,31.19,5.94,70.15,15.75,15.87,92.06,74.6,58.73,15.87,9.52,3.17,1.59,0,0,4.76,6.35,11.11,7.94,0,14.29,9.52,3.17,6.35,3.17,22.22,3.17,1.59,11.11,4.76,0,6.35,22.22,0,17.46,4.76,0,6.35,4.76,0,6.35,0,3.17,3.17,0,0,0,0,0,0,0,0,14.29,4.76,1.59,0,0,1.59,1.59,9.52,0,0,0,0,3.17,3.17,0,0,1.59,0,0,1.59,1.59,0,1.59,1.59,0,0,0,0,0,0,0,1.59,0,1.59,0,0,0,3.17,0,0,6.35,3.17,0,0,1.59,1.59,0,0,0,1.59,1.59,1.59,0,0,0,0,0,7.94,6.35,0,0,0,1.59,0,0
375,private_control,"From what I just read regarding the unexplained drops in Riverbend's water pressure amid the selling off of large portions of company stock and abruptly disbanding the city's independent water quality testing board, it sounds like Aegis Dynamics may be pulling a fast one on the city of Riverbend. The mayor needs to either get to the bottom of what is going on or needs to come clean about what is really happening.",58,Female,Democrat,3,-0.004715562,1,4,5,2,2,5,3,2,1,5,2,6,1,1,1,1,1,1,1,2,5,6,6,5,1,6,4,3,5,3,4,1,1,6,4,1,4,2,2,3,4,3,4,4,73,97.59,19.21,47.74,40.28,36.5,21.92,80.82,72.6,50.68,6.85,1.37,1.37,0,0,0,0,5.48,12.33,9.59,1.37,20.55,5.48,4.11,4.11,0,19.18,8.22,4.11,0,0,0,0,13.7,0,9.59,0,0,2.74,2.74,1.37,4.11,0,1.37,1.37,0,0,0,0,0,0,0,0,5.48,1.37,0,1.37,0,0,0,1.37,0,0,0,0,1.37,1.37,0,0,4.11,0,0,2.74,1.37,0,0,0,0,0,0,0,0,0,0,2.74,0,1.37,0,0,0,0,0,0,6.85,12.33,0,5.48,6.85,0,1.37,0,2.74,0,5.48,2.74,0,0,0,0,0,6.85,2.74,1.37,0,0,2.74,0,0
376,private_control,"This seams awfully suspicious to me.  I read that Aegis Dynamics recently sold off some of their stock and they got rid of their water testing board.  I knew they were up to something.  Right after the town installed their filtration sensors the water has tasted so funny and the water pressure has been messed up.  They tried to say it was just some calibration issues, but I knew that was BS",42,Female,Democrat,3,0.008290514,1,2,2,2,4,5,5,3,3,6,4,5,5,4,3,3,4,5,5,4,4,2,3,3,5,2,5,2,3,2,3,3,2,6,2,2,5,3,3,3,4,3,2,4,72,29.64,48.31,39.59,2.17,14.4,15.28,79.17,75,56.94,20.83,13.89,5.56,0,0,0,8.33,6.94,15.28,4.17,0,12.5,8.33,4.17,6.94,0,22.22,2.78,2.78,1.39,0,1.39,0,19.44,0,6.94,4.17,0,0,1.39,0,1.39,0,6.94,1.39,4.17,4.17,1.39,2.78,0,0,0,1.39,11.11,1.39,0,0,0,0,1.39,9.72,0,0,0,0,0,0,0,0,2.78,0,0,1.39,1.39,0,1.39,0,0,0,0,0,0,1.39,0,0,0,1.39,0,0,0,0,0,0,2.78,4.17,0,0,2.78,0,0,0,2.78,12.5,2.78,0,1.39,1.39,0,0,0,6.94,5.56,1.39,0,0,0,0,0
377,private_savvy,"Well, I believe that the city of Riverbend is doomed. I will not be drinking any of the city water going forward. I will have to budget purchasing bottled water for all of my family's drinking water & cooking. For now I will be showering in the water, but we will have a family meeting to discuss how everyone feels about showering in the water. I will advise everyone to shower with their eyes and mouths shut for the time being...We will see. I will start budgeting as well for the purchasing of bottled water in bulk which we can keep in the basement. I will also talk to the family about maybe moving to a different county in the state. I will play it by ear for now...",40,Female,Democrat,2,-0.0424231,1,5,6,1,5,6,6,6,1,6,1,6,6,5,6,5,1,5,6,2,2,4,4,4,6,2,4,6,5,4,3,4,1,6,1,1,6,4,4,4,4,4,2,4,129,68.84,31.39,85.84,56.53,16.13,15.5,91.47,69.77,62.02,13.95,10.08,6.98,2.33,0,0,0.78,3.88,12.4,8.53,0,18.6,12.4,6.98,3.1,0.78,18.6,0.78,1.55,4.65,4.65,0,0,20.16,2.33,7.75,2.33,0.78,0.78,1.55,0,3.1,0,3.88,3.1,0.78,0,0,0,0,0,0,0,11.63,3.1,0.78,0,0,0,3.1,6.98,2.33,0,0,0,0,0,0,0,7.75,0.78,3.1,0.78,3.1,0,4.65,0,0,0,0,0,0,2.33,0,1.55,0,1.55,0,0,0,0,0,0,8.53,12.4,0,1.55,7.75,1.55,0.78,0.78,3.1,0,3.88,9.3,0,0,0,0,0,13.18,10.08,1.55,0,0,0.78,0.78,0
378,private_control,"This is not good and we don't know the whole story. First water pressure is a mess, then the metallic taste. Then we're told it's normal calibration. And this idea of 100% safe--I like the mayor but can she really say that? Why aren't we hearing from the city water board? Why is the independent board all of a sudden inactive? Should I call a member I know and see if she'll talk to me? Is this Flint all over again? Boiling isn't going to take care of the metallic taste. I have to get a heavier Brita filter tomorrow and see if the more expensive one makes a difference. I really hate these for-profit water companies, all this goddamn privatization. Why? We had the expertise in this city for a hundred years to run the water supply and now we need this gang to take millions from us and put sensors--what all they sensing? Clearly not the right things if they're telling the mayor we're 100% safe. So frustrating. I can afford bottled water, most people can not and they have little kids at home. I don't any longer. And if this is true that the water company muckety-mucks are selling their stock like rats jumping off a sinking ship, I feel sick. I hope that's not true. I am going to make some phone calls.",63,Female,Democrat,3,0.013264924,1,5,5,5,5,5,4,2,3,5,4,5,2,2,4,2,4,2,4,6,1,6,6,1,1,6,5,5,6,1,6,1,1,6,1,4,5,2,2,2,3,2,2,3,229,25.3,23.82,39.08,5.69,11.45,13.1,88.21,74.67,57.64,16.59,10.48,4.8,3.06,0,0.87,1.75,6.11,18.78,8.3,2.62,7.86,10.48,3.93,6.99,3.49,21.4,6.99,6.99,4.37,3.93,0.44,0.44,26.64,1.75,15.28,2.18,2.18,2.62,2.62,1.31,5.68,0,5.68,1.75,3.49,2.62,1.31,1.31,0,0.87,0,0.44,13.1,3.49,0.44,0,0,0,3.06,8.3,0,0,0.87,0,1.31,0.87,0,0.44,2.62,0,0.44,1.31,0.87,0,1.31,0.44,0.44,0,0,0,0,0.87,0,1.31,0.44,1.31,0,0,0,0,0.87,0,10.04,7.86,0,1.75,2.62,0.87,0.44,1.31,3.06,0.87,9.61,3.93,0,0,0,0,0,18.34,5.68,1.75,3.06,0,4.37,3.49,0
379,public_control,I wouldnt trust drinking this water... it's pretty odd that the same company we signed a contract with to filter our water just recently sold a majority of their stock... and our testiing has been different.. someone needs to take some responsibility here and inform everything. everyones health is at risk right now.,31,Female,Independent,3,-0.011015102,1,2,1,1,4,5,6,5,1,6,2,1,5,4,3,5,6,5,5,1,6,1,1,6,6,2,2,1,1,5,2,4,5,6,3,5,1,3,3,2,3,3,4,4,53,18.67,81.19,10.87,5.02,10.6,22.64,88.68,71.7,56.6,20.75,9.43,1.89,5.66,0,0,1.89,11.32,16.98,5.66,0,9.43,9.43,7.55,3.77,1.89,16.98,7.55,3.77,7.55,7.55,0,0,33.96,3.77,16.98,1.89,1.89,3.77,3.77,0,5.66,0,1.89,0,1.89,0,0,0,0,0,0,0,16.98,3.77,0,0,0,0,1.89,11.32,0,0,0,0,0,0,0,0,7.55,0,0,5.66,1.89,0,3.77,1.89,0,0,0,0,0,1.89,0,1.89,0,1.89,0,0,0,0,1.89,1.89,9.43,1.89,0,0,1.89,0,0,0,3.77,3.77,9.43,0,0,0,0,0,0,20.75,18.87,0,0,0,1.89,0,0
380,private_control,"What the mayor`s office says smells fishy about the water is 100 percent safe. Red flags are Aegis Dynamics a tech firm that installed automated smart-filtration sensors, sold their company stock and the citys independent water testing board disbanded.  I will continue to monitor this situation that the municipal water supply in the city of Riverbend has been experiencing intermittent, unexplained drops in pressure, accompanied by a slight metallic taste.",59,Male,Democrat,3,0.017269254,1,5,4,4,4,6,5,5,2,5,1,6,5,5,5,6,6,6,5,6,2,6,6,3,2,6,6,6,5,1,6,5,5,6,5,6,6,4,4,4,4,4,4,4,70,89.52,32.05,4.17,41.28,23.33,30,65.71,51.43,35.71,8.57,2.86,1.43,0,0,0,1.43,5.71,15.71,10,1.43,8.57,7.14,1.43,1.43,0,12.86,7.14,2.86,1.43,1.43,0,0,15.71,0,2.86,0,0,0,0,0,1.43,0,1.43,1.43,0,0,0,0,0,0,0,0,5.71,1.43,0,0,0,0,1.43,1.43,0,0,0,0,4.29,1.43,0,2.86,7.14,0,0,5.71,1.43,0,1.43,0,0,0,0,0,0,1.43,0,0,0,0,0,0,0,0,1.43,0,2.86,7.14,0,0,4.29,1.43,0,0,1.43,4.29,5.71,1.43,0,0,0,0,0,11.43,4.29,4.29,0,0,1.43,1.43,0
381,private_control,"I think that Aegis damaged our water supply in some way and it just seems really weird. I feel like the executives selling off stock shows that something bad is going on, and the problem is only going to get worse. I am really worried about what this means for the future of our water supply here at home. This is going to be very annoying and honestly it shouldn't be my problem but it will be.",41,Male,Independent,2,0.0119508505,1,6,6,5,6,3,2,3,5,2,5,4,3,4,5,5,4,3,4,6,1,5,5,1,2,6,6,6,6,1,6,1,2,6,2,2,6,3,3,4,3,4,3,4,77,15.64,26.01,50.45,1,19.25,12.99,92.21,77.92,62.34,19.48,7.79,5.19,2.6,0,0,0,11.69,14.29,3.9,0,12.99,11.69,9.09,5.19,1.3,23.38,7.79,1.3,3.9,2.6,0,1.3,25.97,0,16.88,5.19,0,1.3,2.6,3.9,1.3,0,5.19,0,5.19,3.9,0,3.9,1.3,1.3,0,0,3.9,1.3,0,0,1.3,0,0,2.6,0,0,0,0,0,0,0,0,6.49,0,1.3,3.9,1.3,0,0,0,0,0,0,0,0,0,0,0,0,1.3,0,0,0,0,0,1.3,5.19,7.79,0,1.3,5.19,0,0,1.3,1.3,0,9.09,9.09,0,0,0,0,0,7.79,5.19,1.3,0,0,1.3,0,0
382,public_savvy,"We all need more information in order to understand the truth about the water that comes out of our faucets.  There are statements saying one thing, and some odd occurrences that may conflict with the statements.  This is too important to ignore.  There are water testing kits available online, as many people as possible should buy one and test their tap water.  Here's to hoping all is well !!",69,Female,Independent,2,0.015259594,1,4,4,3,4,4,4,4,3,4,1,5,4,4,2,4,4,2,2,3,3,4,6,5,3,5,4,3,5,4,4,2,5,4,5,5,3,2,2,2,3,3,2,3,68,51.16,80.39,4.6,41.97,13.6,16.18,85.29,76.47,58.82,10.29,4.41,0,2.94,0,0,1.47,5.88,22.06,4.41,2.94,14.71,10.29,8.82,5.88,0,20.59,10.29,10.29,4.41,2.94,0,1.47,22.06,2.94,11.76,2.94,0,4.41,4.41,0,1.47,0,7.35,4.41,2.94,1.47,1.47,0,0,0,0,0,10.29,4.41,0,0,1.47,0,1.47,5.88,0,0,0,0,1.47,0,0,1.47,4.41,0,0,2.94,1.47,0,0,0,0,0,0,0,0,0,0,1.47,1.47,1.47,0,0,0,0,0,1.47,7.35,8.82,1.47,1.47,7.35,0,0,0,0,0,8.82,2.94,0,0,0,0,0,13.24,5.88,2.94,0,2.94,1.47,0,0
383,private_savvy,It feels like a coverup because of the suspicious timing of the stock sell off and the board disbanding. I think the timing makes it look more related than coincidental timing. I would question if the drops in pressure and metallic taste are unrelated. I find it hard to believe this is all a coincidence when the people responsible for the smart filtration sensors just made such a huge contract with the city around the same time that the higher ups started selling off the company stock.,39,Male,Independent,3,0.016639724,1,6,6,5,6,2,2,2,5,2,4,2,4,2,5,2,4,2,4,4,1,4,4,5,2,5,5,4,4,2,3,1,1,6,1,1,4,3,3,3,3,3,3,4,87,95.44,13.19,93.42,20.23,21.75,21.84,85.06,72.41,51.72,9.2,3.45,3.45,0,0,0,0,5.75,21.84,16.09,0,12.64,3.45,3.45,6.9,0,14.94,9.2,3.45,0,0,0,0,28.74,1.15,18.39,9.2,4.6,1.15,2.3,0,3.45,0,2.3,1.15,1.15,1.15,0,1.15,0,0,0,0,4.6,1.15,0,0,0,0,1.15,1.15,0,0,0,0,0,0,0,0,5.75,0,0,3.45,2.3,0,1.15,0,0,0,0,0,0,1.15,0,0,0,0,0,0,0,0,0,0,6.9,10.34,1.15,0,4.6,1.15,0,2.3,6.9,2.3,4.6,0,0,0,0,0,0,4.6,4.6,0,0,0,0,0,0
384,public_savvy,"The metal flavor, mysterious drops in pressure, executive divestment of stock, and the abrupt dissolution of the independent water board are not separate events; they represent an alarming trend. Calibration is just a word for spin. Riverbend needs the truth, independent testing, and accountability.",35,Male,Republican,2,0.03360209,1,4,5,3,5,5,4,5,4,3,3,5,5,2,3,4,4,2,2,4,3,6,6,5,3,4,5,5,6,4,4,6,6,2,6,6,1,3,3,3,4,3,3,4,44,96.16,5.27,34.4,3.56,14.67,31.82,70.45,52.27,38.64,2.27,2.27,0,0,0,0,2.27,0,13.64,13.64,0,9.09,4.55,2.27,4.55,2.27,13.64,4.55,0,2.27,0,0,2.27,22.73,0,15.91,0,0,2.27,2.27,0,9.09,0,2.27,0,2.27,2.27,0,2.27,2.27,0,0,0,6.82,2.27,0,0,0,0,2.27,2.27,0,0,0,0,0,0,0,0,4.55,0,0,4.55,0,0,2.27,0,0,0,0,0,0,2.27,0,2.27,0,0,0,0,0,0,2.27,2.27,2.27,9.09,2.27,2.27,4.55,0,0,0,2.27,0,6.82,0,0,0,0,0,0,20.45,6.82,11.36,0,0,0,2.27,0
385,public_savvy,"You people are retarded. If you don't' like it, move to some corrupted, destroyed trash-hole  liberal governed formerly nice now third world city, around here we do things the sane way, not the delusional retarded liberal way.  You morons would prefer your Didn't Earn It racism to pick the water company, but smart people prevented you from dooming us all this time. GTFO, liberal smooth brained retards",55,Male,Republican,5,0.08564025,1,5,2,1,1,5,6,6,1,6,1,5,4,4,1,6,4,4,1,2,3,5,2,2,4,5,5,4,3,2,2,1,1,6,1,1,1,2,3,2,3,3,3,3,67,28.93,66.39,69.28,1,16.75,23.88,95.52,62.69,49.25,16.42,10.45,0,2.99,7.46,0,0,5.97,10.45,4.48,0,8.96,7.46,5.97,2.99,4.48,10.45,10.45,2.99,10.45,2.99,1.49,5.97,17.91,1.49,10.45,1.49,0,2.99,1.49,0,7.46,0,16.42,4.48,10.45,0,0,0,0,0,0,7.46,17.91,1.49,0,0,0,1.49,0,13.43,0,0,0,0,11.94,10.45,1.49,0,2.99,0,0,2.99,0,0,2.99,2.99,0,0,2.99,0,0,0,0,0,0,1.49,0,0,0,1.49,1.49,0,10.45,11.94,0,2.99,7.46,0,0,1.49,4.48,4.48,4.48,0,1.49,1.49,0,0,0,19.4,4.48,8.96,0,0,4.48,1.49,0
386,public_savvy,"It seems like this situation calls for investigation and a deeper reach. Things clearly align to fraudulent activity, and there appears to be a distinct lack of transparency. We need to gather and ask questions at town hall, this also requires more local reporting and investigation. Anyone with the ability to do so should make an outreach. This situation calls for justice and answers.",27,Male,Independent,2,0.05976522,1,5,6,3,4,4,5,3,2,5,4,4,5,4,2,4,4,2,3,4,3,5,4,2,5,4,6,4,5,3,3,2,2,6,6,5,5,2,2,3,3,4,4,4,64,66.51,58.66,15.38,43.51,12.8,26.56,92.19,67.19,53.13,10.94,1.56,0,1.56,0,0,0,9.38,12.5,6.25,0,15.63,4.69,6.25,10.94,0,14.06,6.25,1.56,4.69,1.56,1.56,1.56,25,0,23.44,7.81,1.56,4.69,6.25,1.56,1.56,0,1.56,1.56,0,0,0,0,0,0,0,0,9.38,6.25,0,0,0,3.13,3.13,3.13,0,0,0,0,4.69,4.69,0,0,4.69,0,0,4.69,0,0,0,0,0,0,0,0,0,0,0,3.13,0,1.56,1.56,0,0,0,0,0,4.69,9.38,0,1.56,6.25,3.13,0,0,0,0,3.13,0,0,0,0,0,0,10.94,7.81,3.13,0,0,0,0,0
387,public_savvy,"One thing is clear: we must get to the bottom of this issue. As taxpayers, we are entitled to an investigation into Aegis Dynamics and the water quality testing board. We deserve clean, safe drinking water and must to everything in our power to make sure this is researched thoroughly and action taken as needed.",45,Female,Democrat,2,0.008081019,1,4,4,3,4,4,4,3,3,4,3,5,4,3,4,4,4,4,5,4,3,4,5,4,3,4,4,5,4,3,5,3,4,4,4,3,2,2,1,1,2,2,1,3,55,61.45,97.34,1,76.62,18.33,20,83.64,70.91,54.55,14.55,7.27,0,7.27,0,0,0,7.27,12.73,5.45,1.82,16.36,9.09,1.82,9.09,0,18.18,7.27,1.82,9.09,7.27,0,1.82,20,1.82,10.91,1.82,0,7.27,0,0,0,0,3.64,3.64,0,0,0,0,0,0,0,0,9.09,1.82,0,0,0,1.82,0,7.27,0,0,0,0,0,0,0,0,5.45,0,0,5.45,0,0,1.82,0,0,0,0,0,0,1.82,0,5.45,0,3.64,0,0,0,0,1.82,1.82,5.45,10.91,3.64,1.82,5.45,0,0,0,0,5.45,5.45,3.64,0,0,0,0,0,10.91,5.45,3.64,0,0,0,1.82,0
388,public_savvy,"I think a thorough investigation needs to be done to gather proof of any alleged wrongdoing. I must admit, circumstantial evidence is against them. The timing of the smart-filtration sensors, the stock sell-off, the disbandment of the water quality testing board, all looks really bad. Really, really bad. But we need hard evidence before making accusations this serious. Are the news agencies investigating? Is law enforcement involved? We need hard facts and not just conjecture.",55,Male,Independent,2,0.075748265,1,4,4,3,4,5,5,5,1,5,2,5,4,2,3,2,3,2,2,4,3,4,5,4,3,3,4,2,4,4,4,5,6,1,6,6,1,4,3,3,4,3,3,4,75,74.19,32.56,19.26,1,9.38,28,84,64,46.67,8,6.67,2.67,2.67,0,0,1.33,1.33,13.33,9.33,0,9.33,8,5.33,4,1.33,17.33,8,1.33,5.33,2.67,0,2.67,36,1.33,26.67,9.33,1.33,5.33,2.67,4,4,0,5.33,0,5.33,2.67,0,2.67,0,0,0,0,9.33,5.33,0,0,1.33,2.67,1.33,4,0,0,0,0,0,0,0,0,5.33,0,0,5.33,0,0,0,0,0,0,0,0,0,0,0,5.33,0,1.33,0,0,0,0,0,0,2.67,4,0,0,0,1.33,0,2.67,2.67,1.33,6.67,0,0,0,0,0,0,20,8,6.67,2.67,0,0,2.67,0
389,private_savvy,Aegis actions have made a change in water service.  The Mayor is acknowledging the problem but not offering a solution except for waiting correction.  We should enlist them to determine when the correction will take place and why it happened at all.  Other recent Aegis actions indicate red flags perhaps affectinng their their responsibility and must be answered to about their action taken on the water supply and resulting problem.  Or if it is another reason for the pressure drop and taste change coincidentally.  Find ultimate responsibility and get answers.,74,Female,Independent,2,-0.0011952966,1,3,4,2,2,4,4,4,3,5,2,5,5,3,4,4,5,4,4,3,4,4,2,4,3,3,3,3,3,4,5,1,3,6,3,5,4,2,1,2,3,2,2,3,90,59.67,33.76,70.65,NA,15,27.78,85.56,61.11,48.89,8.89,5.56,0,1.11,0,0,4.44,3.33,14.44,7.78,0,10,6.67,4.44,10,1.11,15.56,3.33,2.22,2.22,1.11,1.11,0,40,1.11,30,6.67,8.89,3.33,3.33,2.22,7.78,0,0,0,0,0,0,0,0,0,0,0,11.11,4.44,0,0,0,0,2.22,6.67,0,0,0,0,1.11,1.11,0,0,4.44,0,0,4.44,0,0,1.11,0,0,0,0,0,0,1.11,0,0,0,3.33,0,0,0,0,0,0,8.89,8.89,1.11,2.22,2.22,1.11,0,0,5.56,4.44,2.22,1.11,0,0,0,0,0,6.67,6.67,0,0,0,0,0,0
390,private_control,"This feels off. Something is happening that people are trying really hard to make sound normal. Water pressure dropping and metallic taste isn’t nothing. The timing with that Aegis Dynamics contract is bugs me. Big private tech deal, sensors everywhere, then suddenly weird physical changes start showing up in the system. It could be a coincidence, but it seems a bit suspect.",61,Female,Republican,3,-0.005330071,1,5,6,5,4,5,6,5,2,6,1,6,6,2,5,4,1,2,5,6,2,5,5,4,6,6,6,6,5,1,5,2,2,6,6,5,6,2,1,2,3,2,2,3,62,41.62,11.07,58.85,NA,10.33,27.42,83.87,69.35,46.77,11.29,1.61,1.61,0,0,0,0,9.68,11.29,6.45,0,8.06,9.68,4.84,4.84,3.23,19.35,9.68,3.23,1.61,0,1.61,0,30.65,3.23,17.74,4.84,3.23,3.23,3.23,1.61,3.23,0,0,0,0,0,0,0,0,0,0,0,1.61,0,0,0,0,0,0,1.61,0,0,0,0,1.61,0,0,1.61,3.23,0,0,3.23,0,0,3.23,0,0,0,0,0,0,1.61,0,0,0,0,0,0,0,0,0,1.61,8.06,12.9,0,0,4.84,1.61,1.61,3.23,8.06,0,9.68,0,0,0,0,0,0,16.13,9.68,4.84,0,0,1.61,0,0
