261,public_control,I believe that we need to find out the truth in this situation. We must get all interested parties involved and get to the bottom of the issue before people possibly get sick from the water. I am calling for city council meeting where all residents are invited to attend and speak their mind. This is the only fair way to handle this situation.,64,Male,Republican,1,-0.038653746,1,6,5,2,5,4,3,2,4,2,4,3,1,2,3,2,1,1,1,3,3,4,5,4,3,4,4,3,4,3,3,4,4,6,4,4,3,2,1,2,2,2,1,3,64,81.6,75.49,15.38,88.05,16,18.75,90.63,70.31,53.13,14.06,7.81,3.13,3.13,0,0,1.56,6.25,18.75,7.81,0,15.63,6.25,3.13,4.69,0,18.75,4.69,3.13,4.69,4.69,0,0,25,6.25,12.5,3.13,0,3.13,1.56,0,0,0,7.81,6.25,1.56,1.56,0,1.56,0,0,0,0,12.5,6.25,1.56,0,0,0,3.13,6.25,0,0,0,0,3.13,3.13,0,0,4.69,1.56,1.56,1.56,0,0,1.56,1.56,1.56,0,0,0,0,0,0,3.13,0,4.69,0,0,0,0,0,1.56,10.94,10.94,1.56,0,7.81,0,0,0,1.56,0,4.69,0,0,0,0,0,0,6.25,6.25,0,0,0,0,0,0
262,private_control,"What’s going on? Why was the testing board disbanded? Should we be drinking the water, washing in it, etc.? Is it toxic? What would metals in the water do to us? Do we need to buy water jugs? This could be a disaster. How do I protect my family? Those executives must be crooks, selling off their stock before a crisis hits!",60,Male,Republican,3,0.024219722,1,3,3,2,2,3,3,2,4,3,4,3,3,4,4,4,3,4,4,4,3,5,3,3,3,4,5,4,5,3,4,1,3,6,2,2,2,2,1,2,2,2,1,2,62,28.14,92.62,1,1,6.89,12.9,83.87,69.35,59.68,19.35,9.68,3.23,4.84,0,0,1.61,9.68,14.52,8.06,0,11.29,19.35,3.23,1.61,0,27.42,1.61,0,8.06,6.45,0,1.61,19.35,0,12.9,1.61,3.23,9.68,0,3.23,0,0,6.45,0,6.45,0,0,0,0,0,0,0,9.68,1.61,0,0,0,1.61,0,9.68,1.61,0,0,0,0,0,0,0,6.45,0,0,3.23,3.23,0,4.84,3.23,0,0,0,0,0,1.61,0,3.23,0,1.61,0,0,0,0,3.23,0,4.84,4.84,0,1.61,3.23,0,0,0,1.61,1.61,3.23,1.61,0,0,0,0,0,22.58,3.23,4.84,11.29,1.61,1.61,0,0
263,public_control,"I think it's kind of crazy that there is clear and overt corruption taking place and nothing at all was done about it. We just let the board disband, watched those executives make money on their failure. And nothing will probably happen to them, despite it being clear as day. What a wild and  crazy world we live in.",35,Male,Independent,2,0.07584235,1,5,5,4,4,5,5,4,2,5,2,4,5,5,5,5,4,4,4,4,4,4,3,4,2,2,4,3,3,3,5,1,1,6,1,1,1,4,4,4,4,4,4,4,59,11.79,60.23,30.14,5.94,14.75,15.25,94.92,83.05,59.32,18.64,8.47,1.69,3.39,0,0,3.39,10.17,10.17,3.39,0,11.86,10.17,6.78,8.47,3.39,22.03,10.17,3.39,6.78,3.39,1.69,1.69,25.42,5.08,10.17,1.69,1.69,0,5.08,0,1.69,0,5.08,0,1.69,3.39,0,0,0,0,0,0,8.47,1.69,0,0,0,1.69,0,6.78,0,0,0,0,1.69,1.69,0,0,3.39,0,0,1.69,1.69,0,1.69,0,0,0,0,0,0,0,0,0,0,1.69,0,0,0,0,0,0,8.47,10.17,1.69,0,8.47,1.69,0,0,1.69,5.08,3.39,1.69,0,0,0,0,0,11.86,6.78,3.39,0,0,1.69,0,0
264,public_control,Aegis Dynamics executives selling off large portions of their company stocks abruptly seems really suspicious. The city's independent water quality testing board being disbanded abruptly makes the suspicion even worse. There seems to be more going on than meets the eyes. Is the water still 100% safe or are citizens lives at risk??,56,Male,Republican,3,0.020178288,1,5,6,4,5,5,5,5,1,4,1,5,4,5,1,6,2,1,1,6,2,4,5,6,4,5,6,4,2,2,5,6,6,6,5,5,2,3,1,3,3,3,3,4,53,86.71,29.6,79.41,5.02,13.25,26.42,84.91,66.04,39.62,1.89,1.89,0,0,0,0,1.89,0,11.32,7.55,1.89,11.32,7.55,7.55,3.77,0,22.64,11.32,5.66,1.89,0,0,1.89,24.53,0,16.98,7.55,1.89,0,5.66,1.89,5.66,0,9.43,3.77,5.66,3.77,0,3.77,0,0,0,0,7.55,1.89,0,0,0,0,0,3.77,0,0,0,0,1.89,1.89,0,0,9.43,0,0,7.55,3.77,0,3.77,0,0,0,0,0,0,0,0,0,0,0,0,0,0,0,3.77,0,3.77,7.55,0,1.89,3.77,1.89,0,0,3.77,0,13.21,1.89,0,0,0,0,0,13.21,5.66,0,3.77,0,1.89,1.89,0
265,public_control,"Something fishy is going on here, metallic taste in water often imply heavy metal leaching like lead into the systems. The water is not safe to drink. Also why would the City's independent water quality testing board upruptly disband last week?  The Mayor destroyed the only group with legal authority to prove the water is unsafe. They may be receiving financial support from Aegis Dynamics",22,Female,Independent,3,0.0022990704,1,4,3,4,3,3,6,4,2,4,3,5,4,4,4,4,4,4,3,2,6,2,1,6,1,2,1,2,1,4,2,6,4,6,1,2,3,4,4,4,4,4,4,4,65,89.52,40.06,30.98,20.23,13,23.08,75.38,60,41.54,3.08,1.54,0,0,0,0,1.54,1.54,9.23,9.23,0,12.31,9.23,6.15,1.54,1.54,15.38,9.23,3.08,6.15,0,1.54,6.15,26.15,3.08,15.38,3.08,3.08,1.54,4.62,1.54,3.08,0,6.15,3.08,3.08,0,0,0,0,0,0,0,6.15,1.54,1.54,0,0,0,0,4.62,0,0,0,0,1.54,1.54,0,0,3.08,0,0,1.54,1.54,0,3.08,0,0,0,0,0,0,3.08,0,0,0,1.54,0,0,0,0,3.08,0,6.15,9.23,0,1.54,4.62,0,0,1.54,4.62,0,4.62,3.08,0,0,0,0,0,9.23,4.62,1.54,1.54,0,1.54,0,0
266,private_control,"This whole thing feels off. Water pressure dropping and a weird taste isn’t nothing, no matter what they say. The timing is what bothers me the most. Why would the city suddenly shut down the independent testing board right when people are noticing changes. And the stock sell off from the Aegis people makes it even harder to ignore. It’s probably not some huge disaster, but it doesn’t feel like the full story is being told. I just keep thinking that when officials rush to say everything is totally safe, it usually means they don’t want people asking questions. Something here just doesn’t add up.",62,Male,Democrat,3,0.014569044,1,3,3,2,3,5,5,5,2,5,3,5,4,4,4,4,3,4,4,5,3,5,5,3,2,5,5,5,5,2,5,3,4,5,3,3,5,2,2,2,3,2,2,3,105,12.97,8.09,80.49,49.34,13.13,17.14,93.33,80.95,57.14,14.29,3.81,1.9,0,0,0,1.9,10.48,12.38,7.62,0,7.62,10.48,10.48,4.76,6.67,25.71,8.57,5.71,0.95,0,0,0.95,35.24,2.86,19.05,5.71,2.86,1.9,3.81,0.95,3.81,0,1.9,1.9,0,0,0,0,0,0,0,0,12.38,6.67,0,0,0,0,4.76,4.76,0,0,0,0,0,0,0,0,1.9,0,0,0.95,0.95,0,0.95,0,0,0,0,0,0,0.95,0,0,0.95,0,0,0.95,0,0,0.95,0.95,10.48,11.43,1.9,0.95,5.71,0,0,1.9,6.67,0.95,12.38,0,0,0,0,0,0,15.24,7.62,2.86,0,0,4.76,0,0
267,public_control,"typical corruption in the US government.. why is no one auditing these results and why are the people on top not being punished? the water suddenly tastes strange due to a new company and now the top people are selling stock. actually, who cares if they are selling stock, what's important is that have no been audited by a 3rd party on what actually happened. scoundrels.",28,Male,Independent,3,0.07492781,1,5,4,4,5,4,5,5,4,4,4,4,5,4,4,5,5,4,4,4,3,4,5,4,5,4,4,4,4,3,5,3,4,6,4,5,3,3,3,3,4,3,3,4,66,24.27,31.58,20.79,67.94,13.2,25.76,93.94,77.27,57.58,10.61,3.03,0,0,0,0,1.52,7.58,15.15,9.09,3.03,7.58,13.64,9.09,4.55,4.55,22.73,12.12,1.52,4.55,1.52,0,3.03,37.88,4.55,10.61,0,4.55,0,1.52,3.03,3.03,0,9.09,6.06,3.03,0,0,0,0,0,0,0,13.64,6.06,1.52,0,0,1.52,0,6.06,0,0,0,0,6.06,6.06,0,0,9.09,1.52,0,1.52,6.06,0,1.52,0,0,0,0,0,0,1.52,0,0,0,0,0,0,0,0,0,1.52,7.58,6.06,0,0,4.55,0,0,0,6.06,4.55,13.64,0,0,0,0,0,0,13.64,7.58,3.03,1.52,0,1.52,0,0
268,private_savvy,"I think the Aegis Dynamics company won the bid for a smart water filtration system with our city but they are actually either a shady corporation that got the bid nefariously, are not what they represented themselves to be or are going out of business. My guess is something nefarious is happened because the local independent water testing board was abruptly disbanded.",59,Female,Independent,3,0.0317664,1,4,4,2,4,5,5,4,4,5,4,5,6,3,5,6,4,2,6,4,1,5,6,3,3,5,3,6,5,2,6,1,3,6,1,1,6,3,2,3,4,4,3,4,62,46.42,16.34,79.1,6.37,31,27.42,83.87,70.97,53.23,14.52,9.68,3.23,1.61,0,0,4.84,4.84,16.13,9.68,0,8.06,11.29,1.61,6.45,1.61,22.58,8.06,0,3.23,1.61,1.61,0,32.26,0,17.74,3.23,1.61,0,4.84,1.61,8.06,0,8.06,3.23,4.84,0,0,0,0,0,0,0,12.9,3.23,0,0,0,3.23,0,6.45,0,0,0,0,0,0,0,0,6.45,0,0,6.45,1.61,0,0,0,0,0,0,0,0,0,0,0,0,1.61,0,0,0,1.61,0,0,1.61,6.45,0,1.61,4.84,0,0,0,1.61,6.45,8.06,1.61,0,0,0,0,0,4.84,3.23,1.61,0,0,0,0,0
269,private_savvy,"i think the city sold out to a private tech company that has no genuine interests to the people of this town. the people ultimately have to pay for the city officials who didnt have the best interests of its people. its sad and makes me sick that im reading this. i cannot believe that im writing this right now, my stomach hurts.",49,Male,Independent,2,0.064797044,1,5,2,2,3,3,4,3,4,4,5,5,3,3,6,4,4,4,5,4,1,5,5,4,2,5,4,5,5,2,5,2,3,5,2,2,4,4,3,4,4,4,4,4,63,29.12,4.61,84.92,20.23,15.75,17.46,100,76.19,57.14,23.81,11.11,9.52,0,0,0,0,12.7,25.4,9.52,0,11.11,11.11,3.17,1.59,4.76,20.63,9.52,0,3.17,0,1.59,1.59,19.05,1.59,9.52,4.76,1.59,1.59,0,0,3.17,0,9.52,4.76,4.76,4.76,0,4.76,0,0,1.59,0,14.29,1.59,0,0,0,0,1.59,7.94,0,0,0,0,1.59,0,0,1.59,4.76,0,0,1.59,3.17,0,4.76,1.59,1.59,0,0,0,0,0,0,3.17,0,0,0,0,0,0,0,3.17,14.29,9.52,3.17,0,4.76,0,0,1.59,3.17,3.17,9.52,3.17,0,0,0,0,0,7.94,6.35,1.59,0,0,0,0,0
270,private_control,i wouldn't think the water is safe and would not want to drink i believe that they are only saying its safe to not cause panic through the town and still profit off of people using the water. more new outlets need to shine light into the topic and they need to actually test the water. and with it being sold no telling what they are doing to it,42,Female,Independent,3,0.009518623,1,4,3,3,2,4,6,4,3,4,4,5,6,6,3,6,5,6,5,5,1,4,5,4,5,6,6,6,5,1,5,1,1,6,1,1,4,3,3,3,3,3,3,4,69,43.12,18.24,1,65.92,23,8.7,92.75,79.71,62.32,14.49,7.25,2.9,0,0,0,4.35,7.25,13.04,7.25,0,14.49,10.14,4.35,5.8,5.8,23.19,7.25,1.45,0,0,0,0,26.09,1.45,17.39,2.9,2.9,7.25,0,1.45,2.9,0,5.8,4.35,1.45,1.45,0,1.45,1.45,0,0,0,10.14,2.9,0,0,0,0,2.9,7.25,0,0,0,0,0,0,0,0,4.35,0,0,2.9,2.9,0,1.45,0,0,0,0,0,0,1.45,0,2.9,1.45,0,0,0,0,1.45,2.9,0,11.59,4.35,0,0,1.45,2.9,0,0,1.45,1.45,4.35,0,0,0,0,0,0,4.35,2.9,0,0,0,1.45,0,0
271,public_savvy,"I think it's fairly clear that our city's water testing board being disbanded last week and Aegis Dynamics executives selling off their stock are indications that our water is likely not safe. Despite the mayor's assurances, I find it hard to believe that these things coupled with the strange taste and pressure changes in our water are not related. At a minimum, our water needs to be tested to either confirm or disprove the Mayor's statements.",39,Male,Democrat,2,-3.938824e-4,1,5,5,3,4,5,5,5,2,5,2,5,5,4,3,4,4,5,3,3,4,4,4,4,3,3,3,3,4,4,3,2,5,4,6,5,1,3,3,3,3,3,3,3,76,40.49,40.06,52.19,39.38,25.33,23.68,78.95,71.05,50,18.42,9.21,2.63,5.26,0,0,1.32,9.21,18.42,5.26,0,10.53,7.89,1.32,5.26,2.63,17.11,9.21,3.95,6.58,5.26,0,1.32,30.26,0,19.74,5.26,1.32,1.32,3.95,1.32,6.58,0,1.32,1.32,0,0,0,0,0,0,0,0,7.89,1.32,0,0,0,0,0,6.58,0,0,0,0,0,0,0,0,5.26,0,0,3.95,1.32,0,1.32,0,0,0,0,0,0,1.32,0,1.32,0,0,0,0,0,0,1.32,1.32,3.95,6.58,1.32,0,1.32,0,0,1.32,3.95,1.32,6.58,0,0,0,0,0,0,11.84,3.95,2.63,0,0,5.26,0,0
272,private_control,Wow it's a little suspicious that the independent board is disbanded a week after the city assures citizens the water is safe. It might be worth it to push for further action. Aegis Dynamics might be gaining something from this while people are losing. The fact that the water has a weird taste should be a sign something is wrong.,19,Male,Independent,3,0.00861302,1,4,4,3,4,3,4,3,4,5,3,4,4,3,5,5,4,4,5,5,2,6,6,3,2,5,6,5,6,2,6,3,3,3,4,3,3,3,3,3,4,3,3,4,60,54.7,49.98,19.26,1.23,15,16.67,86.67,76.67,55,13.33,0,0,0,0,0,0,13.33,20,15,0,6.67,20,0,3.33,0,25,11.67,3.33,3.33,0,3.33,0,28.33,0,13.33,1.67,0,1.67,6.67,1.67,1.67,0,8.33,1.67,5,3.33,0,1.67,0,0,0,0,8.33,3.33,0,0,0,1.67,0,3.33,0,0,0,0,1.67,1.67,0,0,1.67,0,0,0,1.67,0,1.67,0,0,0,0,0,0,1.67,0,0,0,1.67,0,0,0,1.67,3.33,1.67,5,8.33,0,3.33,3.33,0,0,0,5,0,10,3.33,1.67,0,0,0,1.67,8.33,6.67,0,0,0,1.67,0,0
273,private_savvy,"This is obviously a cover up and big time fraud. Anyone with a brain cell in their head can clearly see what is going on here. THey took the money and ran knowing the big reeal is about to happen. I would think about doing something about this, but it is so clear that any competent  politician will take this up and fight.",57,Male,Republican,4,0.07383829,1,5,5,2,4,3,4,4,3,5,3,4,5,5,2,6,3,5,5,6,2,5,6,5,6,5,5,6,6,2,6,1,1,6,1,1,6,4,3,3,4,3,3,3,63,18.12,49.5,24.32,6.51,15.75,9.52,95.24,82.54,63.49,17.46,4.76,1.59,0,0,0,3.17,12.7,15.87,6.35,0,12.7,12.7,9.52,7.94,0,25.4,6.35,3.17,1.59,0,0,1.59,26.98,0,15.87,3.17,0,3.17,4.76,3.17,1.59,0,1.59,0,1.59,0,0,0,0,0,0,0,9.52,4.76,0,0,1.59,3.17,0,4.76,0,0,0,0,1.59,1.59,0,0,1.59,0,0,0,1.59,0,3.17,0,0,0,0,0,0,0,0,0,0,3.17,0,0,0,0,0,0,11.11,11.11,0,3.17,6.35,1.59,0,0,1.59,3.17,7.94,6.35,0,0,0,0,0,7.94,6.35,1.59,0,0,0,0,0
274,public_savvy,"In relation to the Riverbends report I do join the villagers and residents who are giving out their complains over the sudden pressure drop down of the water. The department of Riverbend waters should stop blackmailing residents of the purity of water being 100% yet it contains some metallic minerals in it being unsafe for use ,let them come up with a genuine reason.",23,Female,Republican,1,0.021934211,1,5,3,5,5,3,4,4,3,5,5,2,4,5,3,4,4,6,4,5,6,6,4,5,5,5,5,6,6,4,5,5,4,4,5,4,5,3,3,4,3,4,3,2,64,98.11,67.52,83.28,20.23,32,21.88,85.94,65.63,53.13,9.38,6.25,1.56,0,0,0,3.13,3.13,14.06,10.94,1.56,20.31,7.81,1.56,1.56,0,15.63,4.69,1.56,4.69,3.13,0,1.56,14.06,0,9.38,4.69,3.13,3.13,1.56,0,0,0,6.25,3.13,3.13,1.56,0,1.56,0,0,0,0,9.38,3.13,0,0,3.13,0,1.56,6.25,0,0,0,0,0,0,0,0,6.25,0,3.13,3.13,0,0,0,0,0,0,0,0,0,0,0,0,0,0,0,0,0,0,1.56,0,6.25,14.06,0,3.13,12.5,0,0,0,4.69,0,1.56,0,0,0,0,0,0,6.25,3.13,1.56,0,0,0,1.56,0
275,public_savvy,"I cannot imagine our mayor deliberately putting our lives at risk. If anyone were to get sick as a result of tainted water, the city would be liable for hundreds if not thousands of lawsuits. Do you really think they would be able to handle all of the negative press? If he says that the water is save, I believe that the water is safe. 
Aegis Dynamics also has a national reputation to uphold. Do you really think they would put their livelihood, their very company and even their personal lives at risk?",69,Female,Republican,2,0.01625228,1,3,4,3,3,5,5,5,2,4,2,5,4,4,2,4,3,4,3,4,3,5,5,2,2,5,2,4,5,2,5,5,5,1,6,6,1,3,4,4,3,3,4,4,93,24.16,85.18,12.67,9.78,15.5,16.13,88.17,74.19,60.22,16.13,12.9,2.15,2.15,2.15,1.08,5.38,3.23,17.2,6.45,2.15,10.75,12.9,5.38,6.45,2.15,21.51,5.38,3.23,4.3,2.15,1.08,1.08,23.66,1.08,17.2,4.3,1.08,4.3,4.3,2.15,5.38,0,3.23,1.08,2.15,1.08,0,1.08,0,0,0,0,17.2,1.08,0,0,0,0,1.08,13.98,0,0,0,1.08,1.08,1.08,0,0,2.15,0,0,2.15,1.08,0,3.23,1.08,1.08,0,0,0,0,0,0,0,0,1.08,0,0,0,0,5.38,0,3.23,5.38,0,2.15,3.23,0,0,0,0,1.08,7.53,0,0,0,0,0,0,9.68,4.3,3.23,2.15,0,0,0,0
276,public_savvy,"There can be a lot of things going on here. Rather than jumping to conclusions, let's try to wait until we have some more facts. The situation may look bad, but it may be better than it appears. It could be worse also. Once we have a better idea of the problem, then we can examine the causes. Hopefully there will be a relatively easy solution and we can move forward.",64,Female,Republican,1,0.006013423,1,3,5,2,2,4,2,3,3,3,4,4,4,4,3,4,4,2,2,5,2,4,2,6,6,5,5,5,3,1,6,1,5,4,6,6,1,3,1,2,3,2,1,3,71,11.51,84.65,51.38,64.63,11.83,14.08,98.59,83.1,66.2,12.68,7.04,0,7.04,0,0,0,5.63,12.68,8.45,1.41,11.27,19.72,9.86,9.86,0,29.58,8.45,5.63,12.68,7.04,5.63,0,35.21,0,29.58,5.63,1.41,8.45,5.63,0,5.63,0,8.45,5.63,2.82,2.82,1.41,1.41,0,0,0,0,7.04,0,0,0,0,0,0,7.04,0,0,0,0,0,0,0,0,0,0,0,0,0,0,0,0,0,0,0,0,0,0,0,0,1.41,0,0,0,0,0,0,1.41,9.86,14.08,2.82,4.23,5.63,2.82,0,0,5.63,0,7.04,7.04,0,0,0,0,0,14.08,8.45,4.23,0,0,1.41,0,0
277,public_savvy,"I don't know this seems very unlikely that all these people or organizations are keeping such a serious thing a secret from us, and if they in fact are found to be lying and the water is bad, or tainted , and people get sick or sue, then so many would be in trouble, especially the mayor. They are filtering the water so it could be something else causing the taste , I don't know what but common people , quit starting conspiracy theories",46,Female,Republican,2,0.03777176,1,1,1,1,1,4,5,3,1,2,2,5,5,3,5,4,4,4,5,6,1,6,6,1,1,6,6,6,6,1,6,4,6,6,6,6,1,1,1,1,1,1,1,1,81,4.99,26.65,52.89,2.93,40.5,16.05,91.36,80.25,61.73,14.81,6.17,2.47,1.23,0,0,2.47,8.64,14.81,7.41,0,4.94,13.58,6.17,13.58,2.47,24.69,8.64,2.47,2.47,1.23,1.23,0,32.1,1.23,22.22,6.17,1.23,2.47,7.41,0,7.41,0,4.94,1.23,3.7,2.47,0,2.47,0,0,0,0,9.88,1.23,0,0,0,0,0,8.64,0,0,0,0,1.23,1.23,0,0,1.23,0,0,1.23,0,0,2.47,1.23,1.23,0,0,0,0,1.23,0,0,0,1.23,0,0,0,0,1.23,0,8.64,3.7,0,0,2.47,0,0,0,2.47,1.23,8.64,0,0,0,0,0,0,12.35,1.23,8.64,0,0,2.47,0,0
278,public_savvy,"this company is not to be trusted their system will fail ad the water will not be of alit to drink. We must stand together to stop this from happening. Lets make a petition o this company to ban this system from this particular company.  The city's independent water quality testing board was abruptly disbanded last week, what does this say o the situations",41,Female,Democrat,3,0.010379851,1,4,4,3,4,3,2,3,1,3,5,4,4,2,2,3,3,1,1,6,1,5,4,2,1,5,6,3,5,1,6,4,3,4,4,4,2,3,3,3,4,4,3,4,64,52.84,31.33,15.38,43.51,16,21.88,78.13,60.94,48.44,15.63,4.69,0,3.13,0,0,1.56,10.94,17.19,6.25,0,10.94,14.06,0,0,3.13,21.88,4.69,1.56,7.81,6.25,1.56,0,28.13,0,10.94,0,1.56,1.56,0,0,6.25,0,1.56,1.56,0,0,0,0,0,0,0,0,12.5,3.13,0,0,0,0,1.56,4.69,0,0,0,0,0,0,0,0,6.25,0,0,6.25,0,0,1.56,0,0,0,0,0,0,1.56,0,1.56,0,0,0,0,0,0,0,0,3.13,1.56,0,0,1.56,0,0,0,6.25,3.13,4.69,3.13,0,0,0,0,0,7.81,4.69,1.56,0,0,1.56,0,0
279,public_control,"There's something really fishy going on; the government needs to give us an explanation for what is happening. They have been lying to us and taking us for granted; we demand a detailed explanation of what is happening. Our health is at risk!! Who is deceiving us? Is it the company or the government, or were the government officials duped?",27,Female,Independent,3,0.03809336,1,5,5,1,1,5,5,6,2,5,1,5,5,6,5,5,5,2,3,5,5,6,5,5,2,5,1,5,5,2,5,6,6,6,6,6,6,4,4,4,4,4,4,4,60,34.92,99,3.81,NA,12,21.67,95,80,63.33,20,13.33,0,10,0,0,1.67,6.67,11.67,10,0,11.67,15,3.33,5,0,28.33,3.33,0,18.33,10,0,8.33,26.67,0,13.33,3.33,0,1.67,5,1.67,3.33,0,0,0,0,0,0,0,0,0,0,0,18.33,3.33,0,0,0,1.67,0,13.33,0,0,0,0,5,5,0,0,1.67,0,0,1.67,0,0,1.67,1.67,0,0,0,0,0,0,0,1.67,0,1.67,0,0,0,0,1.67,0,3.33,3.33,0,1.67,1.67,0,0,0,0,3.33,13.33,1.67,0,0,0,0,0,16.67,3.33,1.67,3.33,3.33,1.67,3.33,0
280,public_savvy,"We need to stay rational here.  Even if there is something not completely right about this we need to deal with it tactfully.  Going off that ""THEY'RE ALL CROOKS"" isn't going to help anything and certainly won't make our side look better.  Can we find out more information about what's going on first before we decide on a next step how to deal with this?",53,Male,Independent,2,0.12631258,1,5,5,4,3,3,2,3,4,2,4,4,3,2,5,2,6,4,6,6,1,6,5,4,1,6,6,6,6,1,6,3,5,4,4,4,2,3,3,3,3,3,4,4,65,16.83,87.26,81.58,43.1,16.25,10.77,98.46,84.62,66.15,20,9.23,0,7.69,0,0,1.54,10.77,12.31,1.54,1.54,20,9.23,12.31,4.62,4.62,24.62,7.69,4.62,10.77,9.23,1.54,0,35.38,1.54,24.62,7.69,3.08,4.62,4.62,3.08,4.62,0,4.62,3.08,1.54,0,0,0,0,0,0,0,12.31,3.08,1.54,0,0,1.54,0,10.77,0,0,0,0,0,0,0,0,3.08,0,0,3.08,0,0,0,0,0,0,0,0,0,0,0,3.08,0,0,0,0,0,0,0,0,15.38,15.38,1.54,4.62,7.69,1.54,0,0,3.08,0,7.69,7.69,0,0,0,0,0,15.38,4.62,0,1.54,0,6.15,3.08,0
281,private_control,There is graft happening and someone is getting paid to look the other way. This needs to be fully investigated. Aegis is hiding something based on their selloff of company stock. They are trying to shelter themselves from taking responsibility and shifting the responsibility to the new majority share holders.,58,Male,Independent,3,0.0578928,1,4,3,3,3,6,5,5,2,6,1,5,5,5,3,6,2,5,2,3,3,4,5,4,4,3,4,5,4,4,4,4,1,5,2,1,5,3,3,3,4,3,4,4,50,69.05,74.29,1.46,50.98,12.5,28,86,72,52,12,6,0,0,0,0,6,6,12,6,0,14,10,4,4,0,26,4,2,4,2,2,0,32,0,20,2,6,4,4,2,2,0,2,2,0,0,0,0,0,0,0,0,12,2,0,0,0,0,0,8,0,0,0,0,0,0,0,0,10,0,0,8,2,0,0,0,0,0,0,0,0,0,0,2,0,4,0,2,0,0,2,0,2,8,2,0,4,4,0,0,2,2,10,0,0,0,0,0,0,8,8,0,0,0,0,0,0
282,private_savvy,"I don't trust that the company is being truthful. I am also concerned about the city's leadership. Having a water quality testing board is crucial to having safe water and trust from the residents of the city. I don't know if I can trust the water I'm drinking, and I might have to buy bottled water for a while.",58,Female,Democrat,2,0.011899978,1,5,5,4,5,4,4,4,2,4,3,4,4,3,4,4,4,4,5,6,2,5,5,4,2,6,4,6,5,1,6,2,6,5,2,2,5,3,3,3,3,3,3,3,59,25.06,1.12,30.14,73.26,14.75,16.95,86.44,69.49,59.32,11.86,10.17,10.17,0,0,0,0,1.69,13.56,11.86,0,10.17,20.34,3.39,8.47,3.39,23.73,6.78,0,6.78,5.08,0,1.69,20.34,0,8.47,1.69,0,1.69,3.39,0,1.69,0,5.08,3.39,0,1.69,0,0,0,0,0,0,11.86,6.78,0,0,0,1.69,0,1.69,0,0,0,0,0,0,0,0,8.47,0,1.69,5.08,1.69,0,1.69,0,0,0,0,0,0,1.69,0,5.08,0,1.69,0,0,0,0,1.69,0,5.08,1.69,0,0,1.69,0,0,0,1.69,0,11.86,5.08,0,0,0,0,0,15.25,6.78,1.69,0,0,6.78,0,0
283,private_control,Pure frustration that the Aegis Dynamics executives sold off large portions of their company stocks. You ruined a great future for the residents just through pure greed. Why is there such selfishness to do something that change the lives of your future? Was the reason due to wanting more money or something that we don't know?,28,Male,Independent,1,0.0299626,1,3,3,4,5,5,6,4,4,5,5,5,3,4,6,4,6,3,6,6,1,4,6,3,6,6,6,1,3,2,6,2,3,6,1,1,6,4,3,2,3,3,3,4,56,67.11,86.29,24.32,1,14,19.64,94.64,73.21,55.36,16.07,7.14,0,1.79,3.57,0,1.79,8.93,21.43,8.93,0,12.5,7.14,5.36,1.79,1.79,14.29,10.71,5.36,3.57,1.79,0,1.79,26.79,0,14.29,3.57,5.36,1.79,5.36,0,1.79,0,7.14,1.79,5.36,1.79,0,1.79,0,1.79,0,0,12.5,3.57,0,0,0,3.57,0,7.14,0,0,0,0,0,0,0,0,12.5,0,1.79,5.36,7.14,0,1.79,0,0,0,0,0,0,0,0,0,1.79,0,0,0,0,0,0,0,7.14,3.57,0,0,3.57,0,0,0,7.14,3.57,5.36,3.57,0,0,0,0,0,8.93,3.57,0,3.57,0,1.79,0,0
284,private_savvy,It almost appears that Aegis knew ahead of time they were being sold off. Maybe a take the money and run situation. Is it possible the mayor is getting a piece of the action back from Aegis. This would be an excellent reason to disband the independent water quality testing board just before this all comes out.,66,Male,Independent,2,-0.0016572028,1,4,2,2,3,4,3,2,5,4,3,4,2,2,2,3,2,2,2,4,4,6,6,4,3,5,5,4,5,2,4,3,3,6,2,1,6,2,2,3,3,2,3,4,57,83.89,50.51,58.46,46.76,14.25,15.79,89.47,75.44,56.14,10.53,1.75,0,0,0,0,1.75,8.77,19.3,12.28,0,14.04,10.53,5.26,3.51,0,22.81,5.26,3.51,1.75,0,1.75,0,29.82,1.75,15.79,3.51,1.75,1.75,7.02,0,1.75,0,1.75,1.75,0,1.75,1.75,0,0,0,0,0,3.51,0,0,0,0,0,0,3.51,0,0,0,0,1.75,1.75,0,0,5.26,0,0,1.75,3.51,0,0,0,0,0,0,0,0,0,0,0,0,3.51,0,0,0,0,0,0,8.77,10.53,0,5.26,5.26,1.75,0,0,5.26,5.26,7.02,1.75,0,0,0,0,0,7.02,7.02,0,0,0,0,0,0
285,public_control,"Honestly after reading the news story and seeing others opinions about it on facebook, all I can say is that metallic taste of the water is suspicious. Either there's a lot of metal in the water or it's possible that a deceased person's body is inside the water tank. It's absolutely disgusting that the issues of the water's pressure dropping along with the taste being awful isn't of concern at all from the mayor nor the Aegis Dynamics company.",35,Female,Independent,2,0.013014227,1,3,4,1,5,5,5,2,3,6,3,5,5,1,4,2,4,3,5,6,3,5,4,5,3,5,5,2,5,4,6,3,6,6,6,4,3,3,4,3,4,4,4,4,79,83.34,8.15,22.32,1,26.33,20.25,82.28,68.35,56.96,10.13,1.27,1.27,0,0,0,0,8.86,21.52,13.92,0,16.46,11.39,3.8,6.33,2.53,15.19,6.33,3.8,0,0,0,0,22.78,2.53,13.92,2.53,0,1.27,2.53,2.53,6.33,0,3.8,0,3.8,2.53,0,2.53,0,0,0,0,7.59,3.8,0,0,0,0,3.8,2.53,0,0,0,0,1.27,1.27,0,0,1.27,0,0,1.27,0,0,5.06,0,0,0,0,0,0,2.53,1.27,0,0,0,0,0,0,0,0,0,2.53,7.59,0,0,3.8,1.27,0,0,1.27,0,10.13,0,1.27,0,1.27,0,0,12.66,3.8,1.27,0,0,7.59,0,0
286,private_control,"This seems sketchy. Water tastes weird and pressure is acting up, and they’re saying everything is fine but also shutting down the independent testers. The company insiders selling stock right before this also feels suspicious. I’d want someone to actually check the water, not just the city saying “trust us.”",45,Male,Democrat,3,0.027444035,1,6,4,5,5,4,5,4,5,4,5,5,3,4,4,5,4,3,5,6,1,6,4,2,5,6,6,5,6,5,6,2,6,4,6,4,6,1,1,1,2,2,1,3,50,19.3,29.01,63.35,20.23,12.5,24,84,72,50,14,6,2,2,0,0,2,8,12,8,0,8,8,8,12,2,22,8,0,4,4,0,0,32,2,20,6,0,4,4,2,6,0,4,2,2,2,0,2,0,0,0,0,16,6,0,0,0,0,4,6,0,0,0,0,0,0,0,0,4,0,0,2,2,0,2,0,0,0,0,0,0,2,0,0,2,0,0,0,0,0,0,2,2,14,2,0,8,0,0,2,2,0,12,0,0,0,0,0,0,20,8,4,0,0,4,4,0
287,private_savvy,"Someone is on the take in city government.  How much did they pay city officials to get them to allow changes in the water systems?  Sounds like a movie is in the works...  Since water quality testing board is no longer, I would be putting my house upfor sale and getting out of town asap.  Is there any hope for a reversal of this so called system calibration?  It seems that the citizens of Riverbend are up the river for sure.  No amount of bottled water can save the day.",70,Male,Independent,2,3.977269e-4,1,4,5,3,4,4,4,3,4,5,3,5,3,2,4,3,3,2,4,5,2,5,5,5,3,4,4,5,5,4,4,4,5,5,5,4,3,4,3,4,4,4,4,4,90,90.98,46.63,39.59,9.52,12.86,15.56,85.56,68.89,54.44,8.89,4.44,2.22,0,0,0,2.22,4.44,16.67,8.89,0,18.89,10,2.22,3.33,2.22,17.78,5.56,4.44,4.44,0,1.11,3.33,22.22,2.22,11.11,2.22,4.44,3.33,4.44,0,0,0,3.33,1.11,2.22,1.11,1.11,0,0,0,0,0,11.11,3.33,0,0,2.22,0,0,5.56,0,0,0,0,2.22,2.22,0,0,6.67,1.11,1.11,2.22,2.22,0,0,0,0,0,0,0,0,0,0,0,1.11,3.33,0,0,0,0,1.11,0,10,12.22,0,1.11,10,0,1.11,0,4.44,1.11,8.89,1.11,1.11,1.11,0,0,0,11.11,7.78,1.11,2.22,0,0,0,0
