131,public_savvy,"Interesting how the water quality testing board was disbanded right after the suspicious information comes out. Very convenient timing for sure. It's hard to draw any conclusions at this time, but we should consider doing independent tests while the companies are trying to dodge any bullets. We have the power here, lets come together and test our own water to determine if it is safe to drink.",22,Male,Democrat,3,-0.0069127083,1,4,2,2,2,4,5,4,4,3,4,3,5,5,5,3,2,2,5,2,5,2,3,6,5,2,3,1,2,6,2,5,4,5,6,6,3,3,1,2,2,2,1,2,67,50.43,80.84,90.58,42.34,16.75,20.9,88.06,68.66,50.75,10.45,5.97,0,5.97,0,0,0,4.48,11.94,5.97,0,11.94,11.94,4.48,7.46,0,20.9,8.96,0,11.94,7.46,1.49,2.99,32.84,0,19.4,8.96,1.49,2.99,4.48,0,4.48,0,4.48,2.99,1.49,1.49,0,1.49,0,0,0,0,5.97,0,0,0,0,0,0,5.97,0,0,0,0,0,0,0,0,5.97,0,0,5.97,0,0,1.49,0,0,0,0,0,0,1.49,0,0,0,0,0,0,0,0,1.49,1.49,11.94,7.46,0,2.99,5.97,0,0,1.49,5.97,1.49,7.46,0,0,0,0,0,0,10.45,5.97,2.99,0,0,1.49,0,0
132,public_control,My worry is that the smart water system isn't functioning properly which is what has caused the pressure and taste issues. What is the city going to do now that the quality board was disbanded? Something is fishy. We need some oversight on this issue. What is in the water making it taste this way? Should we be boiling our water at this point?,52,Female,Democrat,2,-0.0016312152,1,2,2,2,2,6,6,6,2,6,2,6,4,4,4,4,3,4,4,3,3,5,3,4,3,4,2,6,4,2,4,2,4,6,3,3,3,3,2,3,3,3,3,4,64,13.27,58.66,3.08,20.23,10.67,12.5,76.56,70.31,59.38,23.44,6.25,1.56,4.69,0,0,0,17.19,20.31,7.81,0,6.25,17.19,1.56,1.56,1.56,25,1.56,1.56,6.25,4.69,0,1.56,25,0,12.5,0,3.13,3.13,1.56,0,3.13,0,3.13,1.56,1.56,1.56,0,1.56,1.56,0,0,0,6.25,0,0,0,0,0,0,4.69,0,0,0,0,0,0,0,0,0,0,0,0,0,0,3.13,0,0,0,0,0,0,3.13,0,1.56,0,0,0,0,0,0,0,0,6.25,9.38,1.56,0,4.69,0,0,0,1.56,3.13,14.06,3.13,0,0,0,0,0,10.94,4.69,0,4.69,0,1.56,0,0
133,public_savvy,"People need to get properly educated on the situation in Riverbend and the real reasons behind the drops in pressure and terrible taste.  I have done a great deal of research on this and gone down the rabbit hole so to speak. There is a certain group of executives who suddenly sold off huge portions of company stock, you ever wonder why that is?  Also what happened to the water quality testing board?  Take a closer look at what is going on here before you express anymore uninformed commentary!!",59,Female,Independent,2,-0.0069216043,1,4,2,2,1,5,6,4,4,4,4,4,4,5,4,4,6,4,5,5,2,6,5,3,1,4,6,5,6,2,2,4,6,4,4,4,2,4,2,3,4,3,3,3,89,84.14,77.75,33.23,20.23,17.8,22.47,85.39,75.28,53.93,8.99,4.49,1.12,0,2.25,0,0,4.49,11.24,8.99,0,17.98,5.62,8.99,6.74,0,17.98,6.74,2.25,1.12,0,0,1.12,19.1,1.12,7.87,1.12,3.37,1.12,1.12,2.25,0,0,2.25,1.12,1.12,1.12,0,1.12,0,0,0,0,8.99,2.25,0,0,0,0,1.12,5.62,0,0,0,0,0,0,0,0,6.74,0,0,5.62,1.12,0,1.12,0,0,0,0,0,0,1.12,0,1.12,0,2.25,0,0,0,0,0,2.25,10.11,12.36,1.12,2.25,7.87,1.12,0,0,4.49,4.49,3.37,1.12,0,0,0,0,0,7.87,2.25,1.12,2.25,2.25,0,0,0
134,private_control,"The city and mayor are corrupt and are selling out the people for profits. They're lying about the water quality being bad and are fine with people possibly dying. The Mayor and his cabinent conspired to profit off of the city's people, risking their health and quality of life. We should organize a rally or protest to get some answers and bring the facts of the matter. In order to get a real answer.",32,Male,Democrat,3,0.020683974,1,5,4,4,4,5,4,4,5,4,4,5,5,4,4,5,4,4,5,4,3,5,4,3,2,3,5,2,5,3,3,1,3,6,1,1,6,4,3,3,4,4,4,4,74,92.78,94.28,3.49,7.88,14.8,16.22,89.19,66.22,52.7,5.41,5.41,0,1.35,0,1.35,2.7,0,16.22,12.16,0,16.22,8.11,2.7,9.46,0,16.22,5.41,1.35,2.7,1.35,0,1.35,16.22,0,10.81,4.05,0,1.35,2.7,1.35,1.35,0,4.05,1.35,2.7,1.35,0,1.35,0,0,0,0,21.62,6.76,0,0,1.35,1.35,4.05,12.16,0,0,0,1.35,4.05,4.05,0,0,5.41,0,0,4.05,4.05,0,2.7,1.35,0,0,0,0,0,0,1.35,0,0,2.7,0,0,0,2.7,1.35,0,12.16,5.41,0,1.35,4.05,0,0,0,0,0,5.41,0,0,0,0,0,0,10.81,6.76,1.35,0,0,2.7,0,0
135,private_control,"I was living near flint michigan when something very close to this happened. So my imediate thoughts went there.  And it is just so typical, we live in a profit-crazed system where greedy people feel no shame in stealing from us.  We can see this in our criminal in chief and his 34 felony convictions",67,Male,Independent,2,0.08591491,1,4,4,3,4,3,3,2,4,3,3,5,3,4,5,3,5,3,4,3,5,3,2,5,5,3,3,3,3,5,3,1,1,6,1,1,6,2,2,4,3,3,3,3,55,8.65,95.19,90.83,1,13.75,18.18,89.09,78.18,58.18,20,12.73,3.64,7.27,0,1.82,0,7.27,12.73,1.82,1.82,12.73,5.45,12.73,9.09,1.82,18.18,9.09,0,9.09,7.27,0,1.82,16.36,1.82,7.27,3.64,0,1.82,1.82,0,0,0,3.64,0,3.64,1.82,0,1.82,0,0,0,0,16.36,5.45,0,0,0,5.45,0,10.91,0,0,0,1.82,0,0,0,0,3.64,0,0,1.82,3.64,0,3.64,0,0,0,0,0,0,0,0,0,0,1.82,0,0,0,1.82,0,0,10.91,23.64,0,1.82,18.18,1.82,0,1.82,1.82,5.45,5.45,0,0,0,0,0,0,9.09,5.45,1.82,0,0,0,1.82,0
136,private_control,"This is absurd. The city is paying to make sure our water is clean and isnt harmful and they suddenly disband all the testing that is being used to keep us safe. How will we know if this is ok to drink and that we wont get sick. Im afraid for my and my families sake, I dont know whate weshoudl do about this.!!",35,Male,Independent,3,-0.01611206,1,2,3,3,1,3,4,4,4,3,4,4,4,4,3,4,2,2,3,4,2,6,6,2,5,4,5,3,3,1,5,1,1,2,2,1,1,3,4,3,4,4,3,3,64,1.1,49.35,43.27,20.23,16,9.38,92.19,84.38,62.5,21.88,14.06,6.25,6.25,0,0,1.56,7.81,17.19,3.13,0,7.81,18.75,4.69,7.81,4.69,29.69,9.38,1.56,7.81,7.81,0,0,26.56,1.56,9.38,4.69,3.13,0,1.56,0,3.13,0,9.38,4.69,4.69,3.13,0,3.13,1.56,0,0,0,12.5,1.56,0,0,0,1.56,0,9.38,1.56,0,0,0,0,0,0,0,3.13,0,0,1.56,1.56,0,3.13,1.56,1.56,0,0,0,0,1.56,0,0,0,1.56,0,0,0,0,3.13,0,10.94,4.69,3.13,0,1.56,0,0,0,1.56,1.56,12.5,6.25,1.56,0,1.56,0,0,10.94,6.25,1.56,0,3.13,0,0,0
137,private_control,"This is an very interesting news story and very scandalous in some sense. It's like a movie that I have seen where the water quality has been changed and negatively affected people who live in that community. If this was a real story, lawsuits would be happening. I feel that Aegis Dynamics company is very questionable and tried to get way with responsibility",51,Male,Democrat,2,0.005061358,1,3,4,2,4,3,3,2,3,3,4,4,2,2,3,3,3,3,3,4,3,4,4,4,4,4,4,4,4,2,4,3,4,4,3,3,4,2,2,3,2,2,2,3,63,15.12,31.19,34.16,6.51,15.75,20.63,92.06,71.43,57.14,14.29,4.76,3.17,0,0,0,0,9.52,15.87,6.35,0,7.94,14.29,7.94,6.35,1.59,26.98,1.59,1.59,4.76,1.59,1.59,1.59,25.4,0,12.7,3.17,4.76,1.59,1.59,1.59,1.59,0,4.76,1.59,3.17,0,0,0,0,0,0,0,12.7,6.35,0,0,0,1.59,4.76,4.76,0,0,0,0,0,0,0,0,4.76,1.59,0,3.17,0,0,1.59,0,0,0,0,0,0,0,0,0,0,1.59,0,0,0,0,0,1.59,11.11,12.7,0,0,7.94,1.59,0,3.17,1.59,9.52,7.94,0,0,0,0,0,0,7.94,4.76,1.59,0,0,1.59,0,0
138,private_savvy,It appears that the city of Riverbend has been duped by Aegis Dynamics. Their  installatioin of the automated smart-filtration sensors in city water had caused a metallic taste and a drop in pressure. Supporting this position is the fact that Aegis Dynamics execs have recently sold their company stock. Furthmore Riverbend's testing board was disbanded last week.,72,Female,Independent,2,6.710142e-4,1,3,3,3,4,3,2,2,3,2,5,4,2,2,3,2,5,2,4,2,4,4,4,5,4,2,2,2,5,3,3,3,4,6,4,4,6,4,3,4,3,3,3,3,57,80.4,60.92,33.61,NA,14.25,31.58,66.67,50.88,40.35,10.53,3.51,0,0,0,0,3.51,7.02,17.54,8.77,0,8.77,10.53,0,1.75,0,17.54,0,1.75,1.75,0,0,1.75,19.3,0,3.51,0,1.75,0,1.75,0,0,0,0,0,0,0,0,0,0,0,0,0,8.77,0,0,0,0,0,0,3.51,0,0,0,0,1.75,0,0,1.75,7.02,0,0,5.26,1.75,0,1.75,0,0,0,0,0,0,1.75,0,0,0,0,0,0,0,0,0,0,3.51,14.04,0,1.75,8.77,1.75,0,0,5.26,8.77,5.26,0,0,0,0,0,0,10.53,7.02,0,0,0,1.75,1.75,0
139,private_control,"I definitely do not trust that the water supply is not contaminated. Of course they would assure people it's fine since they don't want panic or a lawsuit, but the selling of shares, disbandment of the quality testing board, and metalic taste of the water are huge red flags that something is going on with the water supply. Everything is about money at the end of the day even at the expense of peoples health and water supply",25,Female,Democrat,3,0.0156222135,1,2,3,2,2,4,5,5,1,5,2,4,5,2,5,2,2,5,4,4,5,4,3,5,4,2,3,2,5,2,2,3,4,6,1,1,6,4,4,3,4,4,4,4,78,74.95,15.29,4.86,20.23,26,15.38,87.18,69.23,56.41,10.26,3.85,1.28,0,0,0,2.56,6.41,14.1,11.54,0,15.38,10.26,3.85,6.41,3.85,16.67,3.85,2.56,2.56,1.28,0,1.28,26.92,1.28,15.38,0,1.28,2.56,2.56,5.13,5.13,0,2.56,1.28,1.28,1.28,0,1.28,1.28,0,0,0,8.97,3.85,0,0,0,0,0,5.13,0,0,0,0,0,0,0,0,8.97,0,0,5.13,3.85,0,2.56,1.28,0,0,0,0,0,1.28,0,0,1.28,0,0,0,0,0,0,0,6.41,3.85,0,1.28,0,1.28,0,0,3.85,0,7.69,1.28,0,0,0,0,0,8.97,2.56,3.85,0,0,2.56,0,0
140,public_control,"I think having read all of these details its a mix of the new tech company they're using, the water board and probably some other factors we are unaware of. We need to address this problem with the city and the powers that be. Something here isn't right and we are paying for worse water system than we started with",55,Male,Independent,2,0.007841855,1,4,4,4,3,4,4,4,3,4,4,4,4,4,5,4,4,4,3,4,3,3,4,3,4,3,5,3,3,4,3,5,5,4,5,5,5,3,3,4,3,3,3,3,60,44.66,77.41,28.56,20.23,20,15,88.33,75,61.67,18.33,10,1.67,6.67,0,0,1.67,8.33,20,8.33,0,13.33,10,3.33,6.67,1.67,18.33,6.67,3.33,8.33,6.67,0,1.67,28.33,1.67,18.33,3.33,1.67,1.67,3.33,0,5,0,3.33,1.67,1.67,0,0,0,0,0,0,0,11.67,0,0,0,0,0,0,8.33,0,0,0,0,1.67,0,0,1.67,3.33,0,0,1.67,1.67,0,0,0,0,0,0,0,0,0,0,1.67,0,0,0,0,0,0,0,0,5,5,1.67,0,3.33,0,0,0,3.33,1.67,6.67,0,0,0,0,0,0,8.33,3.33,1.67,0,0,3.33,0,0
141,public_savvy,The mayors office of Riverside has an obligation to be up front and honest with its citizens. If they are willing to take liberty of only telling us half the story here in this situation then what else are they hiding or not telling us? But more where is that extra money now going from the quality testing board being disbanded?,42,Female,Independent,2,0.03570193,1,5,5,5,6,4,3,3,5,3,4,3,4,3,6,4,3,4,6,6,4,4,3,2,3,5,6,4,5,3,5,4,4,5,4,5,4,3,2,3,3,3,2,4,61,35.92,59.57,71.87,44.83,20.33,18.03,90.16,77.05,62.3,13.11,6.56,0,3.28,0,0,3.28,6.56,13.11,6.56,0,13.11,9.84,8.2,8.2,1.64,18.03,11.48,4.92,3.28,3.28,0,0,18.03,0,9.84,0,0,0,3.28,0,8.2,0,1.64,1.64,0,0,0,0,0,0,0,0,16.39,6.56,0,0,0,1.64,4.92,9.84,0,0,0,0,3.28,3.28,0,0,4.92,0,0,3.28,1.64,0,0,0,0,0,0,0,0,0,0,0,0,1.64,0,1.64,0,0,1.64,0,6.56,11.48,0,1.64,8.2,1.64,0,0,3.28,0,8.2,1.64,0,0,0,0,0,4.92,1.64,0,3.28,0,0,0,0
142,public_control,The city authorities are hiding something from us. We need to be told the truth about this matter. The reduced water pressure is resulting from the sale of the water project to a private firm. I hate it when we are being taken for granted because it makes things awkward for every individual. This issue should be sorted asap because we deserve the best.,42,Male,Republican,2,0.031378984,1,5,5,5,5,5,3,5,2,5,2,6,4,4,4,6,5,1,2,5,2,5,5,5,2,6,5,1,6,2,6,5,5,6,2,6,6,4,3,4,4,4,3,4,64,62.1,91.85,1,1.56,12.8,20.31,87.5,75,59.38,17.19,7.81,1.56,6.25,0,0,0,9.38,15.63,10.94,0,14.06,10.94,3.13,6.25,0,18.75,6.25,3.13,9.38,6.25,1.56,1.56,25,1.56,14.06,0,6.25,4.69,1.56,0,0,0,3.13,0,3.13,1.56,0,1.56,0,1.56,0,0,12.5,3.13,0,0,0,1.56,1.56,6.25,0,0,0,0,0,0,0,0,3.13,0,0,1.56,1.56,0,0,0,0,0,0,0,0,0,0,1.56,0,1.56,0,0,0,0,1.56,0,3.13,3.13,0,0,1.56,1.56,0,0,3.13,3.13,6.25,0,1.56,1.56,0,0,0,7.81,7.81,0,0,0,0,0,0
143,private_savvy,"As a resident and taxpayer, the intermittent and unexplained drops in water pressure are disruptive and annoying. And despite the assurance of the mayor's office, the water tasting off worries me. I do not trust that all is well with the situation. The recent news that executives at Aegis Dynamics have sold large portions of their company stocks also does not bode well. I do not believe that the water is perfectly safe and that all of the facts are being disclosed",63,Female,Independent,3,0.0015164018,1,5,5,4,5,4,4,4,4,4,4,4,4,4,5,4,3,5,5,4,2,5,5,4,4,4,6,4,5,4,4,1,3,5,1,1,3,2,3,2,3,2,3,3,82,52.14,2.86,19.67,58.42,16.4,23.17,82.93,68.29,59.76,9.76,4.88,3.66,0,0,0,1.22,4.88,19.51,10.98,0,10.98,10.98,4.88,8.54,3.66,14.63,3.66,4.88,3.66,1.22,1.22,1.22,23.17,2.44,12.2,2.44,0,0,0,2.44,4.88,0,7.32,4.88,2.44,2.44,0,2.44,1.22,1.22,0,0,8.54,6.1,0,0,1.22,0,2.44,1.22,0,0,0,0,0,0,0,0,7.32,0,1.22,4.88,2.44,0,1.22,0,0,0,0,0,0,1.22,0,0,0,0,0,0,0,0,1.22,0,2.44,2.44,0,0,1.22,0,0,0,1.22,1.22,7.32,0,0,0,0,0,0,8.54,4.88,2.44,0,0,1.22,0,0
144,public_control,This is so scary. Has anyone besides the company tested the waters for harmful substances. Is anything being done to prove to people affected besides just the words from these people? Im curious about who is actually monitoring the water since he city's board was disbanded. Are the only people monitoring it now the corrupt company that caused the problem in the first place?,27,Female,Republican,2,0.027236044,1,5,5,5,5,6,5,4,2,4,2,5,4,2,2,3,2,5,4,3,3,2,5,6,4,3,4,4,3,5,4,5,6,4,6,6,1,3,2,3,3,3,2,4,64,52.84,67.52,32.54,1,12.8,23.44,87.5,71.88,60.94,14.06,4.69,1.56,0,0,1.56,0,9.38,18.75,12.5,1.56,14.06,14.06,10.94,3.13,0,20.31,6.25,1.56,0,0,0,0,35.94,3.13,17.19,3.13,4.69,0,3.13,3.13,3.13,0,4.69,0,4.69,1.56,0,1.56,1.56,0,0,0,15.63,3.13,0,0,0,1.56,1.56,9.38,0,0,0,1.56,1.56,1.56,0,0,4.69,0,0,4.69,0,0,0,0,0,0,0,0,0,0,0,0,0,0,0,0,0,0,1.56,1.56,7.81,6.25,0,0,6.25,0,0,0,3.13,7.81,10.94,0,0,0,0,0,0,9.38,4.69,0,3.13,0,1.56,0,0
145,private_control,I hate corporations. they destroy everything and now my drinking water is suffering. Water is a right not a luxury. How am I supposed to shower to recover from a hard day at work? What are they going to do to fix this? will I need to move to a different town to have decent water pressure?? I hate this. I hate the government. I just need things to work.,28,Female,Democrat,1,0.045278415,1,4,4,4,6,6,4,5,2,4,4,6,6,6,3,6,5,4,6,6,1,4,4,5,5,6,6,4,6,4,6,2,1,6,1,1,5,4,4,4,4,4,4,4,70,43.94,3.95,16.97,1,7.78,14.29,91.43,74.29,58.57,20,12.86,10,0,0,0,2.86,7.14,11.43,7.14,0,12.86,11.43,4.29,1.43,1.43,22.86,4.29,1.43,5.71,0,2.86,2.86,21.43,1.43,10,1.43,1.43,5.71,0,0,2.86,0,8.57,1.43,7.14,5.71,0,5.71,0,4.29,0,0,5.71,1.43,0,0,0,1.43,0,4.29,0,0,0,0,1.43,1.43,0,0,5.71,0,1.43,4.29,0,0,1.43,0,0,0,0,0,0,1.43,0,2.86,0,0,0,0,0,0,0,0,11.43,2.86,0,1.43,0,0,0,1.43,2.86,0,7.14,7.14,0,0,0,0,0,14.29,8.57,0,5.71,0,0,0,0
146,private_savvy,"The deal is shady from the get-go, even before the pressure drops and taste issues. The most suspicious thing though is the company selling their stocks off, which is uncommon and not something that should be happening 1 month after a multi-million deal. On top of that, the disbanding of the water quality testing board is alarming. It makes me think this whole thing was a planned scam to launder money in some way for the company or the city itself.",28,Male,Republican,3,-0.0019963086,1,4,3,3,4,5,4,4,2,5,2,5,4,2,4,4,4,3,4,5,1,5,5,2,2,5,6,5,5,1,5,2,2,5,3,2,6,4,3,4,4,3,3,4,81,75.62,11.88,43.97,1,20.25,18.52,87.65,74.07,58.02,13.58,2.47,1.23,0,0,0,1.23,11.11,20.99,13.58,1.23,12.35,8.64,2.47,7.41,1.23,14.81,7.41,6.17,1.23,0,1.23,0,20.99,0,12.35,3.7,1.23,1.23,2.47,0,4.94,0,3.7,0,3.7,2.47,0,2.47,1.23,0,0,0,4.94,0,0,0,0,0,0,1.23,0,0,0,0,0,0,0,0,9.88,0,0,7.41,3.7,0,1.23,0,0,0,0,0,0,1.23,0,0,0,0,0,0,0,0,1.23,0,2.47,7.41,1.23,0,4.94,0,0,0,3.7,2.47,6.17,1.23,0,0,0,0,0,11.11,4.94,3.7,0,0,0,2.47,0
147,private_control,"Is the water actually healthy and is it able to be drunk by the people living in Riverbend. Why was the city's water quality testing board disbanded, what would happen because of this. Are they actually trying to fix the water crisis or are they trying to cover it up and make more money instead of focusing on peoples health. This issue could be bad because could water that isn't being looked at hurt people and make them sick.",29,Male,Democrat,3,-0.028043315,1,3,1,1,2,6,4,4,1,6,1,4,1,1,1,1,1,1,1,2,1,5,3,5,4,3,6,3,5,2,4,1,6,6,6,5,6,3,2,3,4,3,3,4,79,31.86,55.15,1,1,19.75,15.19,84.81,72.15,58.23,11.39,3.8,0,0,0,0,3.8,7.59,10.13,5.06,0,12.66,15.19,5.06,7.59,1.27,25.32,5.06,1.27,3.8,0,3.8,0,25.32,0,18.99,0,6.33,6.33,1.27,2.53,3.8,0,5.06,0,5.06,3.8,0,3.8,0,0,0,0,7.59,0,0,0,0,0,0,7.59,0,0,0,0,0,0,0,0,2.53,0,0,1.27,1.27,0,7.59,3.8,1.27,1.27,0,1.27,0,0,0,1.27,0,0,0,0,0,0,1.27,0,7.59,7.59,1.27,0,3.8,1.27,0,1.27,0,2.53,6.33,0,0,0,0,0,0,8.86,5.06,1.27,0,0,2.53,0,0
148,public_control,"This looks really suspicious to me. The timing of the stock sales and the decision to terminate the independent water testing board are raising plenty of eyebrows for the city to say there's nothing wrong with the water. I do not say there's proof of wrongdoing but residents should be provided with transparent information and independent testing. If the water is safe, then the city should have nothing to hide and should not be afraid to provide detailed information and to be subject to outside oversight.",22,Male,Democrat,2,0.012629747,1,4,5,5,6,5,5,5,5,5,4,6,4,6,6,5,5,5,5,3,5,4,4,5,4,5,4,4,6,5,4,5,5,6,6,6,5,3,3,4,4,4,3,3,86,73.85,1,61.77,3.38,21.5,25.58,90.7,73.26,56.98,3.49,2.33,2.33,0,0,0,0,1.16,10.47,9.3,0,16.28,13.95,3.49,8.14,4.65,19.77,10.47,1.16,1.16,0,0,1.16,26.74,2.33,17.44,4.65,0,3.49,1.16,1.16,6.98,0,6.98,2.33,4.65,2.33,0,2.33,1.16,0,0,0,9.3,6.98,0,0,0,2.33,2.33,0,0,0,0,0,0,0,0,0,4.65,0,1.16,2.33,1.16,0,1.16,0,0,0,0,0,0,0,0,0,0,0,0,1.16,0,0,2.33,0,2.33,11.63,1.16,0,5.81,4.65,0,0,3.49,1.16,6.98,0,0,0,0,0,0,8.14,4.65,1.16,0,0,2.33,0,0
149,public_control,Is it a coincidence that Aegis Executives sold off large portions of their stock? I don't think so. And then the city's quality testing board was disbanded. No way. Seems like everything was calculated to go exactly the way it did. Who can we trust here if anyone? The people we have to worry about are the citizens that are drinking and using this water supply.,62,Female,Republican,3,0.0043929517,1,6,4,4,4,5,6,4,2,6,4,4,4,3,2,4,5,3,2,4,3,6,6,5,2,5,4,5,5,2,5,5,4,6,5,5,5,3,1,2,3,3,3,3,66,14.87,81.31,13.81,6.9,9.43,16.67,87.88,72.73,57.58,18.18,7.58,1.52,3.03,0,0,1.52,10.61,13.64,7.58,0,9.09,13.64,4.55,7.58,3.03,24.24,1.52,4.55,6.06,4.55,0,1.52,28.79,4.55,12.12,3.03,1.52,1.52,4.55,1.52,1.52,0,1.52,0,1.52,1.52,0,1.52,1.52,0,0,0,12.12,1.52,0,0,0,0,0,10.61,0,0,0,0,1.52,1.52,0,0,6.06,0,0,4.55,1.52,0,1.52,0,0,0,0,0,0,1.52,0,3.03,0,0,0,0,0,0,0,0,6.06,4.55,0,1.52,4.55,0,0,0,1.52,6.06,10.61,3.03,0,0,0,0,0,13.64,7.58,0,3.03,0,3.03,0,0
150,private_control,"OMG, did the Riverbend city officials ever vet this Aegis Dynamics group at all? Or verify their trustworthiness and ability to technically be able to solve the water pressure problem? Initial thought is that one problem of water pressure dropping turns into a possible fiasco that could  bring harm to the city's people, AND not fix the initial water pressure problem. Without full-blown accusing the Aegis Dynamics of wrong doing, it's imperative that the situation be investigated with vigor and speed, and get immediate resolution to prevent harm from coming to the water supply. Then, the city officials need to be counseled and investigation into how they made the decision of going with the Aegis Dynamics group. Maybe they were duped, or maybe they were just negligent or wanted to ""save a buck"", but now it will cost more money to fix AND it has cost mistrust by the community. Wow.",78,Female,Democrat,2,0.014681533,1,2,4,2,3,4,3,4,2,4,4,5,4,3,2,3,2,2,2,3,3,3,4,5,3,3,4,4,4,4,3,3,2,5,3,2,4,2,2,2,2,2,3,2,151,75.91,40.06,43.5,1.26,21.57,23.18,83.44,64.24,50.33,7.95,3.31,0.66,0,0,0,2.65,4.64,13.91,8.61,0.66,12.58,7.95,4.64,7.28,0.66,15.23,5.3,3.31,4.64,1.32,1.99,1.32,23.18,1.32,15.23,3.97,1.32,1.99,3.97,0,3.97,0,5.3,0.66,3.97,1.32,0,0.66,0,0,0,0,10.6,3.97,0.66,0,0.66,1.99,0,5.3,0,0,0,0,0.66,0.66,0,0,5.3,0,0,3.31,1.99,0,0,0,0,0,0,0,0,0,0,1.32,0.66,0.66,0,0,0,0,2.65,0,4.64,5.96,0.66,2.65,3.31,0,0,0,4.64,3.31,3.31,1.32,1.32,0.66,0,0,0.66,12.58,3.31,4.64,1.32,0,1.32,1.99,0
151,private_savvy,"Our water situation seems to be a critical concern even if others are acting as though it isn't.  Noting that water is a life source, I need to focus on solutions right now so that I know that I personally have my needs met and maybe share with others what I am doing.  

What are my options?  

Potentially, go out of the area and secure large containers and obtain purified water. 
Identify if there are any local farmers or rural properties that may have quality water coming from their well.  
That or go further out to areas that would not be associated to the same aquifer.  
Ascertain if this could be a long term issue.  
Attend a town council meeting so that to ascertain what is being done and resources that might already be available on a bigger scale.  

Immediate situation though is I need to know I have what I need and I think I need to start making some calls and head out in the morning to at least secure 25 gallons of water.  

Also identify if there is any filtering process I could easily aquire that would take out whatever harmful elements that is a concern about the water I do have access to and or obtain a testing kit so that I could identify those issues myself.  Remember my motto Trust but verify!",60,Female,Republican,2,-0.019020036,1,3,4,3,4,5,4,5,1,6,1,5,4,3,4,4,3,3,4,3,5,5,5,5,2,4,4,5,4,4,3,1,1,6,1,1,1,2,2,2,2,2,2,2,227,11.85,1.31,84.83,25.95,20.64,16.3,85.9,74.45,59.91,17.18,7.93,7.05,0.44,0,0,0.44,9.25,14.54,4.85,0.44,10.13,12.78,6.61,9.69,0.88,21.59,5.29,2.64,1.76,1.32,0.44,0,25.99,0,19.82,3.96,0.88,4.41,6.61,0,7.05,0.44,1.32,0.88,0.44,0,0,0,0,0,0,0,3.96,1.76,0,0,0,0,0.44,1.32,0,0,0,0,0,0,0,0,2.64,0.88,0,1.76,0,0,1.32,0,0,0,0,0,0,0.88,0,2.64,0,1.76,0,0,0,0,1.32,0,8.37,6.17,0.44,1.32,5.73,0,0,0,3.08,1.76,5.73,1.32,0,0,0,0,0,6.17,3.96,0.88,0.44,0.44,0.44,0,0
152,public_control,"Something kind of sinister is going on. Of course the mayor's office is going to try to save face and minimize the severity of the situation, but a few things; for one, it's already been a month, why would the system still be having calibration issues? Also, the mayor's office didn't even address the taste of the water, just claims it's safe? The city's independent water quality testing board suddenly disbanding last week is the biggest red flag I've ever seen.",23,Female,Democrat,3,-0.01024653,1,3,3,3,2,4,4,4,2,5,2,4,4,2,4,4,1,2,4,5,3,5,5,3,2,5,5,4,4,2,4,3,3,6,4,4,4,3,4,3,4,4,3,4,81,62.54,11.88,10.18,8.65,20.25,17.28,82.72,66.67,53.09,6.17,1.23,1.23,0,0,0,0,4.94,16.05,13.58,1.23,8.64,13.58,9.88,3.7,1.23,19.75,6.17,6.17,1.23,0,1.23,0,30.86,1.23,14.81,0,1.23,2.47,3.7,2.47,3.7,0,3.7,1.23,2.47,0,0,0,0,0,0,0,2.47,2.47,0,0,0,1.23,0,0,0,0,0,0,0,0,0,0,3.7,0,0,3.7,0,0,2.47,0,0,0,0,0,0,1.23,0,0,0,0,0,0,0,0,2.47,0,4.94,4.94,0,1.23,0,2.47,0,0,7.41,6.17,6.17,3.7,0,0,0,0,0,20.99,2.47,6.17,2.47,0,8.64,1.23,0
153,private_savvy,"My first thought is that the timing is supiscious but conclusive. The pressure drops and metallic taste started after new smart-filtration system was installed, so it is reasonable to consider whether the technology or its implementation could be contributing to the problem. However, correlation alone does not prove causation. The mayor's reassurance that the issue is merely system calibration could be true, but the public has little independent evidence to verify that claim. The recent stock sales by Aegis Dynamics executives noteworthy because insider behavior can sometimes signal concerns, although executives sell stock for many legitimate reasons. By itself, that fact does not prove wrongdoing. The most concerning development is the abrupt disbanding of the independent water quality testing board. Removing an oversight body during a period of unexplained disruptions reduces transparencyand may undermine public trust.",32,Male,Independent,3,0.011723846,1,6,6,4,5,5,6,2,1,6,2,6,5,4,2,6,1,1,1,6,1,6,6,4,6,6,6,6,6,1,6,1,2,6,6,6,5,3,4,4,4,4,4,3,136,66.26,4.57,51.9,30.21,17,35.29,76.47,58.82,46.32,5.88,0.74,0.74,0,0,0,0,5.15,16.18,9.56,0.74,8.09,11.03,2.94,7.35,1.47,16.18,9.56,2.94,4.41,0.74,0,3.68,33.09,0,21.32,5.88,3.68,2.21,2.21,2.21,7.35,0,2.21,1.47,0.74,0,0,0,0,0,0,0,5.15,4.41,0.74,0,0.74,0.74,0,0,0,0,0,0,0.74,0,0,0.74,3.68,0,0,2.21,1.47,0,1.47,0,0,0,0,0,0,0.74,0,0,0,0,0,0,0,0,0,0,0.74,2.21,0.74,0,0,0.74,0,0,6.62,1.47,6.62,0.74,0,0,0,0,0,11.03,5.88,3.68,0,0,0.74,0.74,0
154,private_savvy,"Aegis Dynamics appeared to be responsible for the water drop pressure and the metallic taste in water supply, even though they install automated smart-filtration sensors throughout the city's water system, it did not help with the water pressure drop and the taste, the mayor claimed it was just a system calibration and that the water is 100% safe, I knew that was a lie and a local journalist exposed Aegis Dynamics when it is discovered they recently sold off most of theyr company stock and that the water quality testing board had been disbanded, what a corrupt mayor, and even a bigger corrupt company who care for nothing but profits",43,Male,Democrat,3,0.03172919,1,6,5,3,4,4,6,4,5,5,5,4,2,4,5,4,5,4,5,5,5,5,5,5,4,6,6,4,5,4,5,5,5,5,5,5,5,4,4,4,4,3,3,4,110,61.45,34.87,16.38,32.87,110,24.55,76.36,62.73,50,10,3.64,0.91,0,0,0,1.82,6.36,15.45,11.82,0.91,7.27,7.27,4.55,8.18,1.82,12.73,6.36,1.82,0.91,0.91,0,0,16.36,0.91,6.36,2.73,0.91,0,0,0,2.73,0,4.55,2.73,1.82,0,0,0,0,0,0,0,11.82,5.45,1.82,0,0,1.82,0,4.55,0,0,0,0,4.55,3.64,0,0.91,7.27,0,0,6.36,1.82,0,1.82,0,0,0,0,0,0,1.82,0,0,0,0,0,0,0,0.91,0.91,0.91,2.73,7.27,0,1.82,2.73,0.91,0,0,1.82,8.18,1.82,0,0,0,0,0,0,8.18,0,5.45,0,0,0.91,1.82,0
